id,name,artist,artist_followers,artist_genres,album,release_date,album_total_tracks,duration,explicit,popularity
0UkWvPZauWiBjWGuXFhZQn,Tát Nước Đầu Đình,Lynk Lee,135515,"['v-pop', 'vietnamese hip hop', 'vietnamese singer-songwriter']",Tát Nước Đầu Đình,2015-09-05,1,243,False,48
2ePBZnZ9I824PlUdRYxWzA,Rapcoustic 5,Lynk Lee,135515,"['v-pop', 'vietnamese hip hop', 'vietnamese singer-songwriter']",Rapcoustic 5,2019-10-10,1,547,False,43
1SAMe41ZkT2W4zJ4qdqEdM,Tạm Biệt Nhé,Lynk Lee,135515,"['v-pop', 'vietnamese hip hop', 'vietnamese singer-songwriter']",Những Bài Hát Hay Về Học Trò,2017-01-17,9,287,False,41
1htglLMwtGcV8vqeHNFgwQ,Một thời đã xa,Lynk Lee,135515,"['v-pop', 'vietnamese hip hop', 'vietnamese singer-songwriter']",Một thời đã xa,2018-03-12,1,305,False,40
1weKuyH9Vjx3MEvDeGZKpS,Ngày Ấy Bạn Và Tôi,Lynk Lee,135515,"['v-pop', 'vietnamese hip hop', 'vietnamese singer-songwriter']",Những Bài Hát Hay Về Học Trò,2017-01-17,9,318,False,36
2X7fZpatzozRw22t2SKqT7,Không Dám,Lynk Lee,135515,"['v-pop', 'vietnamese hip hop', 'vietnamese singer-songwriter']",Không Dám,2020-06-24,1,215,False,35
0mMhqGXIu9pLCQYx8uMToT,Nắm chặt tay anh nhé,Lynk Lee,135515,"['v-pop', 'vietnamese hip hop', 'vietnamese singer-songwriter']",Nắm chặt tay anh nhé,2018-01-01,2,272,False,33
4Zs8ubzAAJ9whxQldhE4zz,Tát Nước Đầu Đình,Lynk Lee,135515,"['v-pop', 'vietnamese hip hop', 'vietnamese singer-songwriter']",Tát Nước Đầu Đình (Cowvy Version),2021-08-08,1,282,False,32
6rezKdVcKUte5ipsTJGH3A,Cho Tôi Xin Một Vé Đi Tuổi Thơ,Lynk Lee,135515,"['v-pop', 'vietnamese hip hop', 'vietnamese singer-songwriter']",Cho Tôi Xin Một Vé Đi Tuổi Thơ,2013-01-01,1,342,False,23
0SmQ0UWeiHKQtxUej4Rem6,Tháng Năm,SOOBIN,850991,['v-pop'],The Playah,2020-12-15,3,225,False,55
39KWnPNEvbXt423CzjvBfA,Anh Đã Quen Với Cô Đơn,SOOBIN,850991,['v-pop'],Anh Đã Quen Với Cô Đơn,2017-03-14,1,268,False,52
0ZP4bO2ywAv44HiEzzHaq5,Ngày Mai Em Đi,SOOBIN,850991,['v-pop'],Ngày Mai Em Đi,2017-08-02,1,218,False,51
2qc4FFBylFT5YhvMJMX50R,Đi Để Trở Về,SOOBIN,850991,['v-pop'],Đi Để Trở Về,2017-01-17,1,202,False,51
2vRkwfiy4Se8ddUSkdMTmQ,Beautiful Monster,SOOBIN,850991,['v-pop'],KOSMIK,2022-10-31,11,235,False,51
37PyxXH5vlbNcYwxOHbfFn,A Veil of Mist,SOOBIN,850991,['v-pop'],KOSMIK,2022-10-31,11,302,False,50
20jc2qrUesWnyDYnWq0XW8,Nếu Ngày Ấy,SOOBIN,850991,['v-pop'],Nếu Ngày Ấy,2019-07-22,1,293,False,48
63qZf6349d3ngku9hrzLac,The Playah (feat. SlimV) - Special Performance,SOOBIN,850991,['v-pop'],The Playah (feat. SlimV) [Special Performance],2021-05-14,1,450,False,47
6hUpxEKFSjS8metuA1yxlf,Vai Lan Don Dua,SOOBIN,850991,['v-pop'],Vai Lan Don Dua,2017-01-27,1,171,False,47
6bXmKNVe9YIjoyDbz04nWg,Freaky Squad (feat. Touliver),SOOBIN,850991,['v-pop'],Freaky Squad (feat. Touliver),2021-11-30,1,197,False,47
5Sh5CK6GReVbZJqUOnvg0f,"Bài Ka Tuổi Trẻ (feat. Vũ Bùi Thu Thủy, Linh Cáo & Mel G)",JGKiD (Da LAB),59748,['vietnamese hip hop'],"Bài Ka Tuổi Trẻ (feat. Vũ Bùi Thu Thủy, Linh Cáo & Mel G)",2016-05-19,1,230,False,45
1UpDDBrlYmz2WSZbHhHEkP,Đêm Qua,JGKiD (Da LAB),59748,['vietnamese hip hop'],Đêm Qua,2012-11-28,1,231,False,36
67YXSfrnfKMkHbgvcvhKEc,Hát cho đời và hát cho em,JGKiD (Da LAB),59748,['vietnamese hip hop'],Hát cho đời và hát cho em,2015-02-14,1,209,False,30
2dQTfXmi5NldikBZPotZDs,CILU,JGKiD (Da LAB),59748,['vietnamese hip hop'],CILU,2020-11-30,2,194,False,28
48GxqF5CmeZXDwmFTOAXjq,Cây bàng,JGKiD (Da LAB),59748,['vietnamese hip hop'],Cây bàng,2012-02-18,1,189,False,27
1ggXp9qMhUvxKqSecysZnq,Trò Chơi Thua Cuộc,JGKiD (Da LAB),59748,['vietnamese hip hop'],Trò Chơi Thua Cuộc,2022-02-14,1,185,False,26
08JijFqNfBIh2uXe15EhEI,Trên Cao Nhìn Xuống,JGKiD (Da LAB),59748,['vietnamese hip hop'],Trên Cao Nhìn Xuống,2016-10-06,1,322,True,18
4Cjec0YjQXzmgYR2X3yj2w,Bạn Bè,JGKiD (Da LAB),59748,['vietnamese hip hop'],Bạn Bè,2015-09-19,1,215,True,14
5DTvFBpVKXBBtFD0KWA3yr,CILU - Cukak Remix,JGKiD (Da LAB),59748,['vietnamese hip hop'],CILU (Cukak Remix),2020-12-21,1,196,False,13
2ggI84MOzcprRJNQGer0hX,CILU - Instrumental,JGKiD (Da LAB),59748,['vietnamese hip hop'],CILU,2020-11-30,2,194,False,9
51bYFYWODfYOZU0rwvjiCc,Cho Mình Em,Binz,809373,"['v-pop', 'vietnamese hip hop']",Cho Mình Em,2021-04-01,1,206,False,53
2vRkwfiy4Se8ddUSkdMTmQ,Beautiful Monster,Binz,809373,"['v-pop', 'vietnamese hip hop']",KOSMIK,2022-10-31,11,235,False,51
04Mm3BineGdy0oNv8NivQT,Don't Break My Heart,Binz,809373,"['v-pop', 'vietnamese hip hop']",Don't Break My Heart,2022-03-14,1,238,False,50
37PyxXH5vlbNcYwxOHbfFn,A Veil of Mist,Binz,809373,"['v-pop', 'vietnamese hip hop']",KOSMIK,2022-10-31,11,302,False,50
3sV8ExJeOGXbanczafavZv,Bigcityboi (feat. Touliver),Binz,809373,"['v-pop', 'vietnamese hip hop']",Bigcityboi (feat. Touliver),2020-07-05,1,202,True,48
5GXCpnyiCviIiAiZn13tzn,SO FAR,Binz,809373,"['v-pop', 'vietnamese hip hop']",SO FAR,2018-11-01,1,205,False,48
1vtQjPCcdE7FgrxQd5doWP,Sao Cũng Được,Binz,809373,"['v-pop', 'vietnamese hip hop']",Sao Cũng Được,2018-03-08,1,267,False,47
6bXmKNVe9YIjoyDbz04nWg,Freaky Squad (feat. Touliver),Binz,809373,"['v-pop', 'vietnamese hip hop']",Freaky Squad (feat. Touliver),2021-11-30,1,197,False,47
7KNVYQdx7arRoeEJi9C9IR,Tinh Nhan Oi,Binz,809373,"['v-pop', 'vietnamese hip hop']",Tinh Nhan Oi,2019-01-07,1,255,False,46
4UxaMIzEAHLGmNeLoutSaL,So Close,Binz,809373,"['v-pop', 'vietnamese hip hop']",So Close,2019-08-24,1,200,False,46
6gBWxXAK6LTkGAy0062LoV,Họ Yêu Ai Mất Rồi,Doãn Hiếu,56185,['v-pop'],Họ Yêu Ai Mất Rồi,2021-01-20,1,287,False,48
2mvrI7vvk8uWijJfZDAR3w,Hình Như Ta Thích Nhau - Speed Up Version,Doãn Hiếu,56185,['v-pop'],Hình Như Ta Thích Nhau (Speed Up Version),2022-10-21,1,180,False,43
159NPN0CTJeY05EWppQDwJ,Họ Yêu Ai Mất Rồi - Lofi Version,Doãn Hiếu,56185,['v-pop'],Họ Yêu Ai Mất Rồi (Lofi Version),2021-03-12,1,331,False,41
3f1VyI0p27ouruPLxaipR9,Nụ Cười 18 20 - Lofi Version,Doãn Hiếu,56185,['v-pop'],Nụ Cười 18 20 (Lofi Version),2021-04-01,1,273,False,38
2KPmisfkIZlWm1N4Ni4HpB,Bao Lâu Ta Lại Yêu Một Người,Doãn Hiếu,56185,['v-pop'],Bao Lâu Ta Lại Yêu Một Người,2021-10-05,1,231,False,37
6QRgLWKlfQRnv2GFKTgoSa,Hình Như Ta Thích Nhau,Doãn Hiếu,56185,['v-pop'],Hình Như Ta Thích Nhau,2022-10-20,1,213,False,37
4tXgHlFTCem8Vvp2TSTVaj,Bao Lâu Ta Lại Yêu Một Người - Lofi Version,Doãn Hiếu,56185,['v-pop'],Bao Lâu Ta Lại Yêu Một Người (Lofi Version),2021-10-09,1,235,False,33
778VzaD6MoFEoT7kZqamEb,Một Thời Nhanh Như Một Ngày - Official Lofi,Doãn Hiếu,56185,['v-pop'],Một Thời Nhanh Như Một Ngày (Official Lofi),2022-09-14,1,255,False,32
0PAKPdBWHbGpoPyjVae253,Nụ Cười 18 20 - Lofi Version,Doãn Hiếu,56185,['v-pop'],Nụ Cười 18 20 (Lofi Version),2021-07-07,1,161,False,30
6Ugkejs9acwSuQ8m8AluN5,Một Thời Nhanh Như Một Ngày,Doãn Hiếu,56185,['v-pop'],Một Thời Nhanh Như Một Ngày,2022-08-17,1,257,False,28
5hkAuvgkOrd4KpDOlCNsvW,Waiting For You,MONO,127409,['v-pop'],22,2022-08-18,11,266,False,67
6A1IbMKwjvXibcrU1sdqKH,Em Là,MONO,127409,['v-pop'],22,2022-08-18,11,197,False,62
2g4tRvSuOVNAz4p3Yfwy2O,Anh Không Thể,MONO,127409,['v-pop'],22,2022-08-18,11,220,False,49
6oG0E8FNTzwsKpOWFq6Wq2,Quên Anh Đi,MONO,127409,['v-pop'],22,2022-08-18,11,246,False,47
7xYyzBgQlMWXFtvWee5NYR,Kill Me,MONO,127409,['v-pop'],22,2022-08-18,11,229,False,43
3SPqGfmGxumrXeoHzIbhct,Buông,MONO,127409,['v-pop'],22,2022-08-18,11,149,False,41
3HDdwbdH6Oxl2xyd4g5y3D,Xui Hay Vui,MONO,127409,['v-pop'],Xui Hay Vui,2023-01-03,1,163,False,40
3VRQ7NTmCZDdFmLbBuZHUH,L.I.E,MONO,127409,['v-pop'],22,2022-08-18,11,226,False,39
4yr3swKnlTIuW11TzWBdGf,Do You,MONO,127409,['v-pop'],22,2022-08-18,11,218,False,37
0MQLLu2sS9ASM71y3MB5oV,Intro,MONO,127409,['v-pop'],22,2022-08-18,11,60,False,37
769IjpjHNrN36SPvj2ZBKu,Nghe Như Tình Yêu,HIEUTHUHAI,334738,"['v-pop', 'vietnamese hip hop']",Nghe Như Tình Yêu,2021-07-09,1,193,False,60
7opF2QJ8gzlxbV0eBIqszE,ngủ một mình,HIEUTHUHAI,334738,"['v-pop', 'vietnamese hip hop']",ngủ một mình,2022-11-17,1,181,False,60
76dD9BdSOzsRJSGGBjOcUf,ngủ một mình (tình rất tình),HIEUTHUHAI,334738,"['v-pop', 'vietnamese hip hop']",ngủ một mình (tình rất tình),2022-12-15,1,192,False,59
0gdxLgCTbLQUGaar06VrU4,Vệ Tinh,HIEUTHUHAI,334738,"['v-pop', 'vietnamese hip hop']",Vệ Tinh,2022-08-11,1,219,False,57
7AS3f6iaLQ4NZCMZKuhWmy,Bật Nhạc Lên,HIEUTHUHAI,334738,"['v-pop', 'vietnamese hip hop']",Bật Nhạc Lên,2020-06-12,1,200,False,55
0s7RyyUlQfd8mnnboHe18n,Hẹn Gặp Em Dưới Ánh Trăng,HIEUTHUHAI,334738,"['v-pop', 'vietnamese hip hop']",Hẹn Gặp Em Dưới Ánh Trăng,2020-09-25,1,222,False,52
0ReId5SRMspb6ISw0rBsBN,CUA,HIEUTHUHAI,334738,"['v-pop', 'vietnamese hip hop']",CUA,2020-04-05,1,193,True,50
4V2MZcxyltQ4oKSdXOZoV0,DYNAMIC DUO,HIEUTHUHAI,334738,"['v-pop', 'vietnamese hip hop']",DYNAMIC DUO,2022-03-14,1,185,False,48
7K1yMkQqA9ZxHfa2y4XsY6,1-800-LOVE,HIEUTHUHAI,334738,"['v-pop', 'vietnamese hip hop']",1-800-LOVE,2020-07-25,1,266,False,46
4uZs35Zm7ivjQCM7v5nQj8,Mamma Mia,HIEUTHUHAI,334738,"['v-pop', 'vietnamese hip hop']",Mamma Mia,2022-05-16,1,233,False,45
73edZyLpFk9topOtCOFXX2,Ngọn Nến Tình Yêu,Ca Đoàn Hiệp Nhất Việt Nam,0,[],Ngọc Trong Tim 1,2009-01-01,8,330,False,0
2pYFHEy0xp48Le5Bfw5vcX,Có Chơi Có Chịu,Karik,173064,"['v-pop', 'vietnamese hip hop']",Có Chơi Có Chịu,2022-09-25,1,224,False,58
5mG5cQE6SEYxnGCX3I09IC,Vì Mẹ Anh Bắt Chia Tay,Karik,173064,"['v-pop', 'vietnamese hip hop']",Vì Mẹ Anh Bắt Chia Tay,2022-06-13,1,262,False,56
4RZJObXQzsKQLd25LBjBG8,Em Bé,Karik,173064,"['v-pop', 'vietnamese hip hop']",Em Bé,2020-09-22,1,192,False,51
4eap9HaN07ekUsRsXi8su4,Thương,Karik,173064,"['v-pop', 'vietnamese hip hop']",Thương,2016-04-14,1,176,False,51
5azaOutyuZtBrsbJddfaOq,Anh Là Của Em,Karik,173064,"['v-pop', 'vietnamese hip hop']",Anh Là Của Em,2017-10-15,1,216,False,45
2GlFRJfVvl4S0vYl6T19Ul,Không Yêu Đừng Gây Thương Nhớ,Karik,173064,"['v-pop', 'vietnamese hip hop']",Không Yêu Đừng Gây Thương Nhớ,2020-10-28,1,282,False,43
6v8wlIyO0C1gphnSe42XVc,Kiềng 3 Chân,Karik,173064,"['v-pop', 'vietnamese hip hop']",Kiềng 3 Chân,2022-10-04,1,196,False,38
5BdNtfI1O8gqnFvyE7sYGM,Lần Cuối,Karik,173064,"['v-pop', 'vietnamese hip hop']",Thương,2022-07-04,7,164,False,37
22JHOlPzrYQU6GtvMDWp5Q,Vô Thường,Karik,173064,"['v-pop', 'vietnamese hip hop']",Vô Thường,2018-08-01,1,213,False,37
0aOOB0EuwnWuoAqzR4THA9,"Ala Ela (feat. Gducky, Ricky Star & Karik)",Karik,173064,"['v-pop', 'vietnamese hip hop']",Rap Việt Tập 16,2020-11-16,7,245,False,37
41aMYNen9G7uUbqLfV65cF,Tay To,Rapital,102857,"['v-pop', 'vietnamese melodic rap', 'vietnamese trap']",Rapitalove,2021-06-21,6,165,True,58
7fNHfgOxPLcg4mQLhCnOHB,XTC (Xích Thêm Chút) - Remix,Rapital,102857,"['v-pop', 'vietnamese melodic rap', 'vietnamese trap']",Rapitalove,2021-06-21,6,244,False,55
4A4Qdq6Jl4XilO2FS1sq2y,Thủ Đô Cypher - RPT Phongkhin Remix,Rapital,102857,"['v-pop', 'vietnamese melodic rap', 'vietnamese trap']",Thủ Đô Cypher (RPT Phongkhin Remix),2021-06-19,1,193,True,44
2Rx0xErp6UqudLF0eGsunU,U Mê,Rapital,102857,"['v-pop', 'vietnamese melodic rap', 'vietnamese trap']",Rapitalove,2021-06-21,6,213,False,43
1qZ6CjwIIchUP3YWcZ97ox,UầYYY,Rapital,102857,"['v-pop', 'vietnamese melodic rap', 'vietnamese trap']",UầYYY,2021-06-19,1,260,True,39
2RM5qDUGxwG129QthFdl7j,Mưa Đang Rơi - Live,Rapital,102857,"['v-pop', 'vietnamese melodic rap', 'vietnamese trap']",RAPITALOUD (Live),2022-04-16,4,215,False,39
36FjESIK3cc1DKZCUCXJIq,XTC (Xích Thêm Chút),Rapital,102857,"['v-pop', 'vietnamese melodic rap', 'vietnamese trap']",Rapitalove,2021-06-21,6,240,False,39
4hag0r74bWV5hta24rUrDR,Đêm Trong Veo,Rapital,102857,"['v-pop', 'vietnamese melodic rap', 'vietnamese trap']",Rapitalove,2021-06-21,6,220,False,37
7H40FNjvs1MKBAsBJ7OJqj,Sugar,Rapital,102857,"['v-pop', 'vietnamese melodic rap', 'vietnamese trap']",Rapitalove,2021-06-21,6,241,True,31
6nTfbpWJV1kUvWcYko8ZbT,Cuấn Cho Anh Một Điếu - Live,Rapital,102857,"['v-pop', 'vietnamese melodic rap', 'vietnamese trap']",RAPITALOVE (Live),2022-03-19,4,252,False,29
5BdtlbUiauNcghEnOXObqZ,Cây đàn ghi ta một dây,Tam ca nữ Đoàn NTQĐ Việt Nam,0,[],Chiếc lá nhỏ,2018-01-01,12,234,False,0
6uqrA9cQEDR2YyCZ42sIRX,Ít Nhưng Dài Lâu - TVN Remix,Nam Con,852,[],Ít Nhưng Dài Lâu (TVN Remix),2022-04-13,2,215,False,38
6skJyaQvyhlHJXIHI3OT1M,Cho Em Một Lần Yêu - Remix,Nam Con,852,[],Cho Em Một Lần Yêu (Remix),2022-11-03,1,200,False,27
2NgzJNMCxOLuTQag8OaCfm,Hàng Chính Hãng,Nam Con,852,[],Nhạc Siu Hayyy,2022-03-21,10,287,False,16
3bShQFlbqFRGRE1Abqv2Kw,Ít Nhưng Dài Lâu (Short Version) - TVN Remix,Nam Con,852,[],Ít Nhưng Dài Lâu (TVN Remix),2022-04-13,2,14,False,0
3DI4IIVVQFBywwOkh25kmI,Mười Chín Tháng Tám - Lễ Kỷ Niệm 100 Năm Ngày Sinh Đồng Chí Lê Quang Đạo,Nhà Hát Ca Múa Kịch Việt Nam,0,[],Mười Chín Tháng Tám (Lễ Kỷ Niệm 100 Năm Ngày Sinh Đồng Chí Lê Quang Đạo),2022-08-18,1,218,False,0
17iGUekw5nFt5mIRJcUm3R,Chúng Ta Của Hiện Tại,Sơn Tùng M-TP,3958687,"['v-pop', 'vietnamese melodic rap']",Chúng Ta Của Hiện Tại,2020-12-20,1,302,False,63
3ZYrI2prWaAm1RbpCqZzlO,CHẠY NGAY ĐI - Onionn Remix,Sơn Tùng M-TP,3958687,"['v-pop', 'vietnamese melodic rap']",CHẠY NGAY ĐI (Onionn Remix),2018-07-05,1,230,False,61
5fFLotKS1286huYIMQHqz7,Muộn Rồi Mà Sao Còn,Sơn Tùng M-TP,3958687,"['v-pop', 'vietnamese melodic rap']",Muộn Rồi Mà Sao Còn,2021-04-29,1,276,False,60
2z9iLlNBt1aLZUCFgXby97,CÓ CHẮC YÊU LÀ ĐÂY,Sơn Tùng M-TP,3958687,"['v-pop', 'vietnamese melodic rap']",CÓ CHẮC YÊU LÀ ĐÂY,2020-07-06,1,202,False,58
0YRtuiIMa3FM3LywGlJIii,Buông Đôi Tay Nhau Ra,Sơn Tùng M-TP,3958687,"['v-pop', 'vietnamese melodic rap']",m-tp M-TP,2017-04-01,18,227,False,56
1Huy9G87D6pbIveFulsH0P,Âm Thầm Bên Em,Sơn Tùng M-TP,3958687,"['v-pop', 'vietnamese melodic rap']",m-tp M-TP,2017-04-01,18,293,False,55
0f5yQttJS5nNxRAleF4kZO,Hãy Trao Cho Anh,Sơn Tùng M-TP,3958687,"['v-pop', 'vietnamese melodic rap']",Hãy Trao Cho Anh,2019-07-02,1,246,False,55
6UdpjBhLNMFl3dH46iXlGi,Nắng Ấm Ngang Qua,Sơn Tùng M-TP,3958687,"['v-pop', 'vietnamese melodic rap']",SKY DECADE,2022-10-06,4,196,False,54
7rjtRM1AgmmraeTTX8tofW,THERE'S NO ONE AT ALL,Sơn Tùng M-TP,3958687,"['v-pop', 'vietnamese melodic rap']",THERE'S NO ONE AT ALL,2022-04-28,1,172,False,53
59u8Iu6cAugFqtA1avGFRT,Cơn Mưa Xa Dần,Sơn Tùng M-TP,3958687,"['v-pop', 'vietnamese melodic rap']",SKY DECADE,2022-10-06,4,197,False,53
5iZHnufFUgATzrpGgH1K0W,Ánh Sao Và Bầu Trời,T.R.I,130494,"['indie viet', 'v-pop', 'viet lo-fi']",Ánh Sao Và Bầu Trời,2021-09-10,1,261,False,64
5IO873C4IP8pXdsXcJiBes,Chúng Ta Sau Này,T.R.I,130494,"['indie viet', 'v-pop', 'viet lo-fi']",Chúng Ta Sau Này,2021-01-29,1,211,False,54
2MORKZPutesHpzm7bCU5GW,Chúng Ta Sau Này - Lofi,T.R.I,130494,"['indie viet', 'v-pop', 'viet lo-fi']",Chúng Ta Sau Này (Lofi),2021-03-01,1,202,True,45
10SAggBfdhrIQgWgqfrJx8,Cho Ngày Không Còn Nhau,T.R.I,130494,"['indie viet', 'v-pop', 'viet lo-fi']",Cho Ngày Không Còn Nhau,2021-10-05,1,237,False,32
5k1HeLPY9XnOTXLmkH6177,bên em từ ngày này qua ngày nọ,T.R.I,130494,"['indie viet', 'v-pop', 'viet lo-fi']",bên em từ ngày này qua ngày nọ,2022-12-28,1,230,False,45
5TzRsrN1CYRPlUyBagEB6b,Sau Chia Tay... Ai Cũng Khác,T.R.I,130494,"['indie viet', 'v-pop', 'viet lo-fi']",Sau Chia Tay... Ai Cũng Khác,2020-06-15,2,283,False,43
4eLiKNd9xsyJZWmTTjWvYt,Mỗi Khi Em Nhìn Anh,T.R.I,130494,"['indie viet', 'v-pop', 'viet lo-fi']",Mỗi Khi Em Nhìn Anh,2022-11-23,1,268,False,42
0hKmcs5NMfmQuyiuIf7XKn,Nhạc Buồn Ngày 2,T.R.I,130494,"['indie viet', 'v-pop', 'viet lo-fi']",Nhạc Buồn Ngày 2,2022-09-02,1,264,False,38
0UOlHyYSqIWTLms8jNLgIc,Nắng Đêm (feat. Trường An),T.R.I,130494,"['indie viet', 'v-pop', 'viet lo-fi']",Nắng Đêm (feat. Trường An),2018-10-24,1,230,False,35
1KJEuUZ6NbHL2V9WZKxDdv,Cuộc Gọi Cuối,T.R.I,130494,"['indie viet', 'v-pop', 'viet lo-fi']",Cuộc Gọi Cuối,2022-06-02,1,266,False,33
0Cy7uOfTjJrmHkNEPBBZxf,Bên Trên Tầng Lầu,Tăng Duy Tân,70215,['v-pop'],Bên Trên Tầng Lầu,2022-06-10,1,184,False,63
1jtrGtWxnZUeKtSN4Xxh1e,Dạ Vũ,Tăng Duy Tân,70215,['v-pop'],Dạ Vũ,2021-08-15,1,202,False,52
36BQLOKzGVk7PjQtBnef5b,Ngây Thơ,Tăng Duy Tân,70215,['v-pop'],Ngây Thơ,2020-04-09,1,253,False,40
1nut0CDNqlXFtV4U3Md5ds,Phải Lòng (feat. Phong Max),Tăng Duy Tân,70215,['v-pop'],Phải Lòng,2022-09-01,3,218,False,43
5ymd9f58aw4mRjxXFvgQKh,052 (Không Phai 2),Tăng Duy Tân,70215,['v-pop'],"052 (Không Phai, 2)",2020-05-12,2,196,False,40
6BvAuB0I0O2YqTajhTOqKE,Ngay Tho (Chinese Version),Tăng Duy Tân,70215,['v-pop'],Ngay Tho (Chinese Version),2022-02-05,1,252,False,39
0T4unJIFcPbWwQiq0bfCuP,Dạ Vũ (Phong Max's Version),Tăng Duy Tân,70215,['v-pop'],Dạ Vũ (Phong Max's Version),2021-09-03,1,240,False,38
7up6yGxwdFhW52rt1wsyPl,Bên Trên Tầng Lầu - House Remix,Tăng Duy Tân,70215,['v-pop'],Bên Trên Tầng Lầu - Version 2,2022-07-28,5,201,False,37
1rQnYbVbGiiJgDJ4T0WALv,Xa Nhau Cả Hai Đều Buồn,Tăng Duy Tân,70215,['v-pop'],Xa Nhau Cả Hai Đều Buồn,2020-12-01,2,258,False,37
0c3YRNemUwOHHvacX9YKYW,Ngây Thơ (Phong Max Remix),Tăng Duy Tân,70215,['v-pop'],Ngây Thơ (Phong Max Remix),2020-08-09,1,268,False,34
05X3a0YGmS1rbH50aL8lGF,Một Ngàn Nỗi Đau,Hứa Kim Tuyền,51287,['v-pop'],Một Ngàn Nỗi Đau,2022-06-23,1,322,False,61
17vw2n25C8g7KKCilJ3pER,anh sẽ đến cùng cơn mưa,Hứa Kim Tuyền,51287,['v-pop'],anh sẽ đến cùng cơn mưa,2022-12-16,1,261,False,55
0dHUKYXP9PJMN0RpR9dpFR,hai mươi hai (22) [feat. AMEE],Hứa Kim Tuyền,51287,['v-pop'],COLOURS,2022-05-31,9,239,False,50
6IkNu9xwCD3ei9gaAfbPXA,Sài Gòn Đau Lòng Quá,Hứa Kim Tuyền,51287,['v-pop'],Sài Gòn Đau Lòng Quá,2021-03-28,1,309,False,50
1G9gGCq1i7smFoaNnAdt8f,Nếu Anh Là Em (feat. Hứa Kim Tuyền),Hứa Kim Tuyền,51287,['v-pop'],CONG,2022-11-01,8,273,False,44
3jtwwdfOYDQCVCLBTqPi08,Giấc Mơ Tình Yêu,Hứa Kim Tuyền,51287,['v-pop'],"Trạm 2 - Xuân Hạ Thu Đông, rồi lại Xuân 2",2022-11-10,9,274,False,40
7Fw9ny4x1Zb0HfYteZCoa4,chúng ta chỉ là đã từng,Hứa Kim Tuyền,51287,['v-pop'],chúng ta chỉ là đã từng,2022-12-21,1,355,False,39
3OTaToe1QW60xLUk1jNzQz,Gật Đầu,Hứa Kim Tuyền,51287,['v-pop'],"Trạm 2 - Xuân Hạ Thu Đông, rồi lại Xuân 2",2022-11-10,9,194,False,37
5TAH5b4tcaUOUHpuBfuDKQ,213 (2 Người 1 Nhà 3 Con Mèo) (Live ver at XHTĐRLX),Hứa Kim Tuyền,51287,['v-pop'],"Trạm 2 - Xuân Hạ Thu Đông, rồi lại Xuân 2",2022-11-10,9,220,False,37
0CQVfEsInniLHOvWn5AOAI,bàn kế bên,Hứa Kim Tuyền,51287,['v-pop'],những tổn thương đã qua,2022-12-20,5,273,False,37
03bqM2UGtEOCSAPas8vSdu,Thi Đua Là Yêu Nước - Chương Trình Đại Hội Thi Đua Yêu Nước Tỉnh Bắc Ninh Lần Thứ V),Hợp Xướng Học Viện Âm Nhạc Quốc Gia Việt Nam,0,[],Từ Làng Sen (Chương Trình Đại Hội Thi Đua Yêu Nước Tỉnh Bắc Ninh Lần Thứ V),2022-10-26,3,158,False,1
3FATE7hNJ9XGCcxubih7gA,Giúp Anh Trả Lời Những Câu Hỏi,Vương Anh Tú,8795,['v-pop'],New Hits,2015-07-10,15,290,False,39
0u9TiqYMXeSHDiW2nbSmxS,Nước Mắt Lưng Tròng,Vương Anh Tú,8795,['v-pop'],Nước Mắt Lưng Tròng,2022-08-26,1,307,False,36
3uDOaEfKVOWjMvCEogTBhC,Cuộc Gọi Nhỡ,Vương Anh Tú,8795,['v-pop'],Cuộc Gọi Nhỡ,2020-10-29,1,226,False,35
1uBQoINVGW7AJ10tJAmcgn,Anh Đâu Phải Anh Ấy,Vương Anh Tú,8795,['v-pop'],Anh Đâu Phải Anh Ấy,2021-03-02,1,304,False,35
3GCNQGTS2DYXyBO0dVrIX1,Phản Bội Chính Mình,Vương Anh Tú,8795,['v-pop'],Phản Bội Chính Mình,2021-11-13,1,240,False,31
5xvCbrnZvLUeZR2RL6wcDH,Gặp Nhưng Không Ở Lại,Vương Anh Tú,8795,['v-pop'],Gặp Nhưng Không Ở Lại,2021-04-08,1,281,False,24
5PjUAZbDNHRPapCAzRCaKy,Thay Tâm Đổi Lòng,Vương Anh Tú,8795,['v-pop'],Thay Tâm Đổi Lòng,2022-11-26,1,325,False,24
6SxhLnanyYCXsag6Kpf9G8,Chưa Đủ Để Giữ Em,Vương Anh Tú,8795,['v-pop'],Chưa Đủ Để Giữ Em,2022-12-01,1,336,False,24
3SpxxwFj3FFtmRL0ov3heN,May Mà Không May,Vương Anh Tú,8795,['v-pop'],May Mà Không May,2022-10-06,2,249,False,22
2pOQjynU9sV2eIQXWiuMHm,Lu Mờ Tâm Trí,Vương Anh Tú,8795,['v-pop'],Lu Mờ Tâm Trí,2022-12-17,1,272,False,22
2QqUfCa7GbxQm6gB3K4hhi,See Tình - Cucak Remix - Cukak Remix,Cukak,108114,['viet remix'],See Tình - Cucak Remix (Cukak Remix),2022-05-05,1,170,False,72
7skGrIrRzO0APhASzAKfNi,Gu - Cukak Remix,Cukak,108114,['viet remix'],Gu (Cukak Remix),2021-07-14,1,177,True,48
4pLa3LHYBNnyC8yojD8fO0,Chạy Khỏi Thế Giới Này - Cukak Remix,Cukak,108114,['viet remix'],Chạy Khỏi Thế Giới Này (Cukak Remix),2022-07-05,1,295,False,47
6cVohsG3hJgnctUZ1eLJFH,Đường Tôi Chở Em Về (Cukak Remix),Cukak,108114,['viet remix'],Đường Tôi Chở Em Về (Cukak Remix),2021-07-07,2,249,False,46
1austpKq1bluHmAOtoCTJ3,Forget Me Now (Remix),Cukak,108114,['viet remix'],Forget Me Now (Remix),2021-09-01,1,233,False,44
6kezwedGSwsW4RobS1a7py,Em Là Nhất - Speed Up,Cukak,108114,['viet remix'],Em Là Nhất (Speed Up),2022-05-27,1,179,False,44
5aVbCL9UN8wWQ5OU3VuhX2,Tình Ca Tình Ta - Cukak Remix,Cukak,108114,['viet remix'],Tình Ca Tình Ta (Cukak Remix),2022-03-09,1,214,False,44
6a2CmP0QkzWup3fzgD2JIA,Hương (Cukak Remix),Cukak,108114,['viet remix'],hương (Remix),2021-10-08,3,211,False,40
1dqmU0mKbrWrGhcOKJwpMn,Anh Yêu Vội Thế (Remix),Cukak,108114,['viet remix'],Anh Yêu Vội Thế (Remix),2022-04-12,1,245,False,39
14iVYkidiiJUu2qCBIf8kb,Cứ Nói Yêu Lần Này (Speed Up) - Cukak Remix,Cukak,108114,['viet remix'],Cứ Nói Yêu Lần Này (Speed Up) [Cukak Remix],2022-09-15,1,168,False,36
5Msoarj5hk9LguTtiIyqug,Ngày Đầu Tiên,Đức Phúc,854455,['v-pop'],Ngày Đầu Tiên,2022-02-11,1,209,False,60
5Fmtix3LkYpcXI7nVFpEyC,"Quá Khứ Đôi, Hiện Tại Đơn",Đức Phúc,854455,['v-pop'],"Quá Khứ Đôi, Hiện Tại Đơn",2022-09-24,1,311,False,51
1Gu3moX7qQp4t2jk6kJ0C6,Cũng Đành Thôi,Đức Phúc,854455,['v-pop'],Cũng Đành Thôi,2016,1,273,False,47
7BSyMiUKDSXdnZ9wTmLPKv,Năm Ấy,Đức Phúc,854455,['v-pop'],Năm Ấy,0000,1,260,False,47
2PZENjHdoBW7u1qLB1Twra,Yêu Được Không,Đức Phúc,854455,['v-pop'],Yêu Được Không,2019,1,332,False,44
1SlUGdFlL8KssF9yglckks,Cứ Thở Đi,Đức Phúc,854455,['v-pop'],Cứ Thở Đi,2022-05-27,1,225,False,43
5YouPnnFSfNJPXgrWZ0P8C,Hơn Cả Yêu,Đức Phúc,854455,['v-pop'],Hơn Cả Yêu,2022-05-05,1,256,False,41
5uye47llqkE8Oyn56Y3IkW,Nguoi Oi Nguoi O Dung Ve (feat. Suboi),Đức Phúc,854455,['v-pop'],Nguoi Oi Nguoi O Dung Ve (feat. Suboi),2020-09-27,1,200,False,40
43VzVmdtLNVuTDLA5ajACT,Ta Còn Yêu Nhau,Đức Phúc,854455,['v-pop'],Ta Còn Yêu Nhau,2017,1,207,False,40
7teufwU5fNKeUkbAHZHjN4,Có Hẹn Với Thanh Xuân,Đức Phúc,854455,['v-pop'],"Trạm 1 - Xuân Hạ Thu Đông, rồi lại Xuân 2",2022-11-10,11,244,False,36
4xalxj2hfKiU3Pws87fSeO,Yêu Sắc Yếu,Osad,248924,"['v-pop', 'vietnamese melodic rap']",Yêu Sắc Yếu,2021-04-22,1,177,False,56
1lk4eijOWwRJGR2BDakaJT,Người Âm Phủ,Osad,248924,"['v-pop', 'vietnamese melodic rap']",Người Âm Phủ,2018,1,131,False,48
47KahNBNjHtpTlJyU7hh33,có người đón em rồi..,Osad,248924,"['v-pop', 'vietnamese melodic rap']",có người đón em rồi..,2022-12-29,1,147,False,46
6TkuthZivul62v9hJL5x8n,Lời Có Cánh,Osad,248924,"['v-pop', 'vietnamese melodic rap']",Lời Có Cánh,2022-10-20,1,169,False,46
44hsBA7SRBMRpNlhq87Fff,Lung Lay,Osad,248924,"['v-pop', 'vietnamese melodic rap']",Lung Lay,2022-03-17,1,162,False,40
3LlkrfYiAKpah2mngQ4r2o,Củ Lạc,Osad,248924,"['v-pop', 'vietnamese melodic rap']",Củ Lạc,2018,1,210,False,39
68NwPtQoxprritFxZTKIPJ,Ghép Môi,Osad,248924,"['v-pop', 'vietnamese melodic rap']",Ghép Môi,2022-10-13,1,210,False,39
7sppnEHDyWGy4FpmnHE3Ys,Yêu Em Kiểu,Osad,248924,"['v-pop', 'vietnamese melodic rap']",Yêu Em Kiểu,2022-11-03,1,155,False,39
67L47FNr5hTduHLuWgVegY,Lung Lay - Remix,Osad,248924,"['v-pop', 'vietnamese melodic rap']",Lung Lay (Remix),2022-03-23,1,150,False,38
5NWdI1U4tfx45YtsBB6fLk,Em Nào Có Hay Anh Nhớ Thương,Osad,248924,"['v-pop', 'vietnamese melodic rap']",Em Nào Có Hay Anh Nhớ Thương,2018,1,83,False,36
1xoadYaxtOp9gHDwgmPDuz,Sài Gòn Hôm Nay Mưa,Hoàng Duyên,40802,['v-pop'],Sài Gòn Hôm Nay Mưa,2021-05-29,1,247,False,61
6IkNu9xwCD3ei9gaAfbPXA,Sài Gòn Đau Lòng Quá,Hoàng Duyên,40802,['v-pop'],Sài Gòn Đau Lòng Quá,2021-03-28,1,309,False,50
1qBhlpdpjgsevbE4FCe3KN,Heaven (feat. Hoàng Duyên),Hoàng Duyên,40802,['v-pop'],Heaven (feat. Hoàng Duyên),2022-05-30,2,194,False,40
1rCurScVWswOm8jVmCOLxn,Mưa Hồng,Hoàng Duyên,40802,['v-pop'],Mưa Hồng,2022-06-14,1,225,False,39
5EHV4QKIcf95NDmXH8nMg7,Rồi Mình Sẽ Gặp Nhau - Mười: Lời Nguyền Trở Lại Original Soundtrack,Hoàng Duyên,40802,['v-pop'],Rồi Mình Sẽ Gặp Nhau (Mười: Lời Nguyền Trở Lại Original Soundtrack),2022-10-04,1,245,False,38
7sZ2QWlXZqODQkmxRnJGjT,Sài Gòn Hôm Nay Mưa - 1 9 6 7 Remix,Hoàng Duyên,40802,['v-pop'],Sài Gòn Hôm Nay Mưa (1 9 6 7 Remix),2021-07-05,1,264,False,37
6lhrQC5IvCv4ICCGs9IZfo,Chàng Trai Sơ Mi Hồng,Hoàng Duyên,40802,['v-pop'],Chàng Trai Sơ Mi Hồng,2021-03-12,1,292,False,37
