id,name,artist,artist_followers,artist_genres,album,release_date,album_total_tracks,duration,explicit,popularity
0u3C1cgg3SmRyz8oxq8YAe,Người Chơi Hệ Đẹp (Remix),1 9 6 7,96067,['viet lo-fi'],Người Chơi Hệ Đẹp (Remix),2021-06-01,1,165,False,34
0VfkVqOIBH2szKsMnHyZKQ,Duyên Trời Lấy 2 (Lofi),1 9 6 7,96067,['viet lo-fi'],Duyên Trời Lấy 2 (Lofi),2022-09-12,1,193,False,34
0n6GPPMcNIheHTS3Si6Zfq,Giá Như Anh Ở Đây (Lofi),1 9 6 7,96067,['viet lo-fi'],Giá Như Anh Ở Đây (Lofi),2021-06-01,1,196,False,33
1VZEVmvaGulgN3RmWJAdiH,Anh Yêu Vội Thế (Remix),1 9 6 7,96067,['viet lo-fi'],Anh Yêu Vội Thế (Remix),2022-04-12,1,225,False,33
6zSKUu7FRFNkA0EDeoXtHv,Ngôi Nhà Hoa Hồng (Remix),1 9 6 7,96067,['viet lo-fi'],Ngôi Nhà Hoa Hồng (Remix),2021-09-01,1,168,False,30
3rzrnu7aycggDrkiJFFhVl,Ba Kể Con Nghe,Nguyễn Hải Phong,1188,[],Ba Kể Con Nghe,2018,1,238,False,39
0cVJzC7KE0dhYqOd3m5Sha,Dòng Thời Gian - Metaplay R&B,Nguyễn Hải Phong,1188,[],"Tuyển Tập Các Ca Khúc Pop Và Acoustic Của Nguyễn Hải Phong, Vol. 4",2022-11-10,4,313,False,15
7zmHsZAiErFKgbUssI9yHU,Sẽ Chiến Thắng (SEA Games 2022 Version),Nguyễn Hải Phong,1188,[],Sẽ Chiến Thắng (SEA Games 2022 Version),2022-05-22,1,307,False,13
44to11j0W4SBLMViUXpSdo,Nơi Ấy,Nguyễn Hải Phong,1188,[],Nơi Ấy,2007,1,215,False,12
5KS6kT7zqvJ0K68XAvCpFn,Ngồi Hát Đỡ Buồn - Metaplay Acoustic,Nguyễn Hải Phong,1188,[],Ngồi Hát Đỡ Buồn (Metaplay Acoustic),2022-08-26,1,197,False,9
6oGsMU1OZ167jCGthUGaub,Sẽ Chiến Thắng (SEA Games New Version Remix),Nguyễn Hải Phong,1188,[],Sẽ Chiến Thắng (SEA Games New Version Remix),2022-05-22,1,308,False,4
0vJGSgyvxaJg4uC6qrzj5v,Nơi Ấy - Metaplay Lofi,Nguyễn Hải Phong,1188,[],Nơi Ấy (Metaplay Lofi),2022-08-23,1,236,False,4
1lzIKbaFWFs6uZlTnKgHot,Take Off - Hiphop Version,Nguyễn Hải Phong,1188,[],Take Off,2022-02-22,22,130,False,3
3ELT0YFZmSyQXicAfcYm0k,Tôi Là Người Việt Nam (SEA Games Remix),Nguyễn Hải Phong,1188,[],Tôi Là Người Việt Nam (SEA Games Remix),2022-05-22,1,282,False,3
1PtEPJYNjVYPsfeT2Xrmoj,Trọc - Metaplay EDM,Nguyễn Hải Phong,1188,[],Trọc (Metaplay EDM),2022-10-03,1,317,False,2
3y6kYOBeVg8jtUiBdTR0pD,Già Cùng Nhau Là Được,TaynguyenSound,117323,"['v-pop', 'vietnamese hip hop']",Già Cùng Nhau Là Được,2018-11-13,1,231,False,58
1vG1po7CMKs979IuxjXPAl,Mây Lang Thang,TaynguyenSound,117323,"['v-pop', 'vietnamese hip hop']",Mây Lang Thang,2020-02-02,1,199,False,54
0pQ67Kp2kED4ISy1ieGPEq,Ghé Qua,TaynguyenSound,117323,"['v-pop', 'vietnamese hip hop']",Ghé Qua,2017-12-08,1,237,False,54
4b2cexOFGasSFp9Z48sEMz,Lãng Du,TaynguyenSound,117323,"['v-pop', 'vietnamese hip hop']",Lãng Du,2017-03-20,1,213,False,44
2CiY4WZS8207DiCvBriW4D,Ghé Qua - Rapcoustic,TaynguyenSound,117323,"['v-pop', 'vietnamese hip hop']",Ghé Qua (Rapcoustic),2019-02-15,1,240,False,43
5l8eOas5fVutSK0DrDsJpx,Có Một Người Luôn Cười Khi Anh Đến,TaynguyenSound,117323,"['v-pop', 'vietnamese hip hop']",Có Một Người Luôn Cười Khi Anh Đến,2018-10-10,1,274,False,42
23VYzQ6KsTd0weHcDiAEwc,Đi Qua Hoa Cúc,TaynguyenSound,117323,"['v-pop', 'vietnamese hip hop']",Đi Qua Hoa Cúc,2017-02-13,1,251,False,39
4D8KZbLZFDrc0ynma3Hcvk,Thôi Trễ Rồi Chắc Anh Phải Về Đây,TaynguyenSound,117323,"['v-pop', 'vietnamese hip hop']",Thôi Trễ Rồi Chắc Anh Phải Về Đây,2018-05-07,1,196,False,39
5YHYzMBOm7Sgw2QZlaIqQ2,Một Thuở Thanh Bình,TaynguyenSound,117323,"['v-pop', 'vietnamese hip hop']",Một Thuở Thanh Bình,2017-05-11,1,252,False,38
1hUBB3bgU0p0FWmU2T7EUg,Sống Cho Hết Đời Thanh Xuân 2,TaynguyenSound,117323,"['v-pop', 'vietnamese hip hop']",Sống Cho Hết Đời Thanh Xuân 2,2019-12-13,2,533,True,37
5OE0IzdS8Bs4UaLvDoTXKD,Có Đâu Ai Ngờ,Cầm,1299,[],Có Đâu Ai Ngờ,2022-09-08,1,220,False,59
6LjnpeWCzBpbkP5DqeuqlU,Mưa Ơi Đừng Rơi,Cầm,1299,[],Mưa Ơi Đừng Rơi,2022-12-08,1,209,False,49
7F8sPTALZH1EzYSO8y2p5O,giá như anh ở đây (feat. Cầm),Cầm,1299,[],giá như anh ở đây (feat. Cầm),2022-12-20,1,220,False,29
249dPfANuQ810Ha1dqfT7h,Có Đâu Ai Ngờ - BEGINS Remix,Cầm,1299,[],Có Đâu Ai Ngờ (Begins Remix),2022-11-06,1,163,False,26
4dBAcZZwVW5aaqi07tEQxd,Trở Về Mái Trường Xưa,Cầm,1299,[],Trở Về Mái Trường Xưa,2022-11-24,1,228,False,15
3IMtTktuYLeF2drqnaMYQ4,Như Những Phút Ban Đầu,Hoài Lâm,350652,"['v-pop', 'vietnamese bolero']",Có Khi,2020-08-15,12,335,False,50
0F3wiY12imwsU4rpQAxUaF,Hoa Nở Không Màu,Hoài Lâm,350652,"['v-pop', 'vietnamese bolero']",Hoa Nở Không Màu,2020-05-30,1,328,False,47
0m5EkQBvxTPTVA83BvrE4E,Chia Cách Bình Yên,Hoài Lâm,350652,"['v-pop', 'vietnamese bolero']",Đồng Dao Show,2022-12-04,11,286,False,44
3551T3YUXzxJN9I0aQbD7n,Có Khi,Hoài Lâm,350652,"['v-pop', 'vietnamese bolero']",Có Khi,2020-08-15,12,255,False,41
6xR4HTVCjQYHf8yRmH7sDJ,Hoa Nở Không Màu - Acoustic Version,Hoài Lâm,350652,"['v-pop', 'vietnamese bolero']",Hoa Nở Không Màu (Acoustic Version),2020-07-15,1,320,False,41
3xyVMVFmezgIwNZYyDZbsu,Cô Đơn Trong Nhà Mình,Hoài Lâm,350652,"['v-pop', 'vietnamese bolero']",Cô Đơn Trong Nhà Mình,2020-09-10,1,297,False,40
6IHX0kz7fKaM7bv1hXNiCp,Buồn Làm Chi Em Ơi,Hoài Lâm,350652,"['v-pop', 'vietnamese bolero']",Buồn Làm Chi Em Ơi,2020-06-26,1,273,False,39
4GrizSfOa8idlPjDiOqK3Y,Nếu Như Là Định Mệnh,Hoài Lâm,350652,"['v-pop', 'vietnamese bolero']",Có Khi,2020-08-15,12,273,False,32
5kXNXzUb22Gq6IRKS2L9Pd,Trách Hai Từ Thương Em,Hoài Lâm,350652,"['v-pop', 'vietnamese bolero']",Trách Hai Từ Thương Em,2022-09-27,1,330,False,31
1xvyXlxIoDaT1Hget7kd6o,Trước Sau Trời Cũng Mưa,Hoài Lâm,350652,"['v-pop', 'vietnamese bolero']",Trước Sau Trời Cũng Mưa,2022-07-03,1,320,False,31
6OcOCgmPa1a57xAAF7qKkW,Querry,QNT,94832,"['v-pop', 'vietnamese hip hop', 'vietnamese melodic rap']",Querry,2022-06-01,1,231,False,54
6Yl0VlggFHwxoNPVjbJXLI,Em làm gì mùa dịch ?,QNT,94832,"['v-pop', 'vietnamese hip hop', 'vietnamese melodic rap']",Em làm gì mùa dịch ?,2021-01-31,1,194,True,46
4Vj3LCvCXSNbnnrVqmhbr1,ANHS EMS (Chill n Free),QNT,94832,"['v-pop', 'vietnamese hip hop', 'vietnamese melodic rap']",ANHS EMS (Chill n Free),2021-08-26,1,268,False,45
0muglCULgZHsCLuZccg7g6,Em Không Đi Đâu (feat. Giang),QNT,94832,"['v-pop', 'vietnamese hip hop', 'vietnamese melodic rap']",Em Không Đi Đâu,2020-08-10,2,233,False,43
2y3lOuZHoqU6OoShJDB7Aj,Say Em,QNT,94832,"['v-pop', 'vietnamese hip hop', 'vietnamese melodic rap']",Say Em,2020-10-28,1,219,False,43
5OqVWkQlXJSYwlgMkmOSEI,Green Love (ChillnFree),QNT,94832,"['v-pop', 'vietnamese hip hop', 'vietnamese melodic rap']",Green Love (ChillnFree),2021-12-12,1,168,False,34
7jWlSshKfAWtadVDkk1QX4,Baby Call,QNT,94832,"['v-pop', 'vietnamese hip hop', 'vietnamese melodic rap']",Baby Call,2021-01-31,1,226,True,31
12kHGL5eCdqT0hULIHEc4q,LastCall,QNT,94832,"['v-pop', 'vietnamese hip hop', 'vietnamese melodic rap']",LastCall,2021-08-16,1,228,False,31
5U1YKXunWKCBQ6QNNAdWjw,Yêu Vào Mùa Dịch (feat. RPT Orijinn),QNT,94832,"['v-pop', 'vietnamese hip hop', 'vietnamese melodic rap']",Yêu Vào Mùa Dịch (feat. RPT Orijinn),2021-11-03,1,213,False,29
5riE1Yid8CZQt5PGinsoJz,On Stream,QNT,94832,"['v-pop', 'vietnamese hip hop', 'vietnamese melodic rap']",On Stream,2021-06-20,1,197,False,25
2NEzxeMKW0mk5pr7tcrvs2,Có Chàng Trai Viết Lên Cây,Phan Mạnh Quỳnh,762495,"['v-pop', 'vietnamese singer-songwriter']",Mắt Biếc (Original Motion Picture Soundtrack),2019-12-20,21,306,False,49
3lWdsBlhTvI1JouQsegpHF,Nước Ngoài,Phan Mạnh Quỳnh,762495,"['v-pop', 'vietnamese singer-songwriter']",Nước Ngoài,2020-01-01,1,213,False,40
6HE6jZ7J0T6Rry0lcGTZYv,"Gặp Gỡ, Yêu Đương Và Được Bên Em",Phan Mạnh Quỳnh,762495,"['v-pop', 'vietnamese singer-songwriter']","Gặp Gỡ, Yêu Đương Và Được Bên Em",2021-08-08,1,240,False,39
1hNeQxweRIQ8nK6ujzSUbo,Có Chàng Trai Viết Lên Cây / Chuyện Tình Thảo Nguyên (Mashup),Phan Mạnh Quỳnh,762495,"['v-pop', 'vietnamese singer-songwriter']",Giao Lộ Thời Gian,2022-11-01,10,377,False,39
5HKoAtKVhcc2XFYmxZOeNg,NHẠT,Phan Mạnh Quỳnh,762495,"['v-pop', 'vietnamese singer-songwriter']",NHẠT,2020-01-01,1,208,False,39
2I22S9Vs08sNeuD71sJLpI,Tết Về Sớm Nhé,Phan Mạnh Quỳnh,762495,"['v-pop', 'vietnamese singer-songwriter']",Tết Về Sớm Nhé,2020-01-01,1,187,False,32
5CjsvQsKuUpGJHieGnIAC7,Có Một Nơi Như Thế,Phan Mạnh Quỳnh,762495,"['v-pop', 'vietnamese singer-songwriter']",Có Một Nơi Như Thế,2020-01-01,1,235,False,37
0mgObhRxcWQxUmmVFrbhNx,"Sao Cha Không (From ""Bố Già"" Original Motion Picture Soundtrack)",Phan Mạnh Quỳnh,762495,"['v-pop', 'vietnamese singer-songwriter']","Sao Cha Không (From ""Bố Già"" Original Motion Picture Soundtrack)",2020-01-01,1,280,False,37
3Q5QdILpa7GDF4MvmsU8ZH,Đa Đoan,Phan Mạnh Quỳnh,762495,"['v-pop', 'vietnamese singer-songwriter']",Đa Đoan,2022-09-28,1,201,False,36
7bOtIxIqte2fRu0jkwLrOl,Đi Để Trở Về Mashup,Phan Mạnh Quỳnh,762495,"['v-pop', 'vietnamese singer-songwriter']",Đi Để Trở Về Mashup,2020-01-01,1,224,False,18
5KYv3kORBKUmVEoqbRRWxt,Từng Là Của Nhau,Táo,171040,"['v-pop', 'vietnamese hip hop']",Từng Là Của Nhau,2022-08-30,1,269,False,56
3pvYWi5tsEn2pM9y3zaApN,2 5,Táo,171040,"['v-pop', 'vietnamese hip hop']",2 5,2017-04-20,1,252,False,51
4MRXbWH2BzuUZcoabj6HRh,Blue Tequila,Táo,171040,"['v-pop', 'vietnamese hip hop']",Blue Tequila,2020-08-27,2,203,False,49
1Yfhr5vHnDgu5KnbXARSeV,Chơi Vơi,Táo,171040,"['v-pop', 'vietnamese hip hop']",Đĩa Than,2021-05-05,7,237,False,42
6O8btCjbTlhSgsFj0JmUa0,Vẫn,Táo,171040,"['v-pop', 'vietnamese hip hop']",Vẫn,2016-06-22,1,143,False,40
4s9KzC1CduhQWbekLNCLLB,Red Rum,Táo,171040,"['v-pop', 'vietnamese hip hop']",Red Rum,2022-05-27,1,220,False,40
2Tm2vf5JWQvhTPYkuTXbgW,Tương Tư,Táo,171040,"['v-pop', 'vietnamese hip hop']",Tương Tư,2020-11-27,2,226,False,36
2iRE9qBk5CYmaVTaJWKTcu,Xin,Táo,171040,"['v-pop', 'vietnamese hip hop']",Đĩa Than,2021-05-05,7,190,False,32
5oyOoiXrnGIhhvIILnwGXj,Tìm,Táo,171040,"['v-pop', 'vietnamese hip hop']",Tìm,2015-04-11,1,235,False,32
13IcGyX8PEIj3JR1NKjrGM,Cả Nhà Cô Đơn,Táo,171040,"['v-pop', 'vietnamese hip hop']",Đĩa Than,2021-05-05,7,232,False,31
2Gazl1MAVX8vmo8E659Vq8,Real Love - The Heroes Version,My Anh,23280,"['indie viet', 'v-pop']",Real Love (The Heroes Version),2021-07-18,1,244,False,52
6quhjqnjf99EvO6nCVLpgu,Mỗi Khi Anh Nhìn Em,My Anh,23280,"['indie viet', 'v-pop']",Mỗi Khi Anh Nhìn Em,2022-11-15,1,192,False,42
4MZkrUWN2C0dhc7Xn1LPug,Nhìn Những Mùa Thu Đi,My Anh,23280,"['indie viet', 'v-pop']",Nhìn Những Mùa Thu Đi,2022-06-04,1,173,False,41
28mj6cmfJWSxOCdeNRbyWw,Got You,My Anh,23280,"['indie viet', 'v-pop']",Got You,2020-05-04,1,265,False,36
6eky30oFiQbHUATDlOCGys,Pillars,My Anh,23280,"['indie viet', 'v-pop']",Pillars,2021-06-27,1,219,False,28
4YbFRcDcC6wcd77nzTEaIa,Lời Cảm Ơn,My Anh,23280,"['indie viet', 'v-pop']",Lời Cảm Ơn,2021-01-13,1,218,False,27
757UcFkzXQqIL0etbUsdFH,Yên,My Anh,23280,"['indie viet', 'v-pop']",Yên,2021-10-20,1,221,False,26
0uPBV4DBZ8okrsLyFlrL0V,Mashup Công Chúa Bong Bóng X Cô Gái Trung Hoa - The Heroes Version,My Anh,23280,"['indie viet', 'v-pop']",Mashup Công Chúa Bong Bóng X Cô Gái Trung Hoa (The Heroes Version),2021-06-09,1,256,False,23
7sg896VBSLnqc4Ov2m7k9c,Chiện Tình Yên,My Anh,23280,"['indie viet', 'v-pop']",Ở NHÀ 2M,2022-10-17,6,235,False,21
79DJNyUVaFcERcewOuTatf,|Nâng Niu| Cây Và Đất,My Anh,23280,"['indie viet', 'v-pop']","Nâng Niu Lắm, Thiên Nhiên Ơi - Touliver x Mỹ Anh x NESCAFÉ",2021-10-14,4,197,False,20
3wn8HJNjkY4wzTBy35ZvQ6,bao tiền một mớ bình yên?,Bon Nghiêm,2074,[],bao tiền một mớ bình yên?,2020,1,300,False,65
5pecBfvm22kQON5STs5q45,có ai ở đây không? - Extended version,Bon Nghiêm,2074,[],có ai ở đây không? (Extended version),2021-10-08,1,330,False,42
7zJ6yuuOnjjRqbKv1zfCAl,một đời (feat. buitruonglinh),Bon Nghiêm,2074,[],một đời (feat. buitruonglinh),2022-12-21,1,328,False,39
6i4rBZgI9MrZvTutwDj6ii,Nói Em Không Tin,Bon Nghiêm,2074,[],Nói Em Không Tin,2022-09-07,1,257,False,35
31hKqGvKjf40OnMkxNIywC,Duyên Ta Trời Lấy,Bon Nghiêm,2074,[],Duyên Ta Trời Lấy,2022-07-31,1,341,False,21
6w6e47PqB1SfUUnQv6WOGM,Duyên Ta Trời Lấy,Bon Nghiêm,2074,[],Duyên Ta Trời Lấy,2022-08-05,1,311,False,15
4GrI9UYJ4Ob8Az2tDh4eeT,Ngọt Ngào Ở Ngày Mai,Suboi,124411,"['vietnamese hip hop', 'vietnamese melodic rap']",Ngọt Ngào Ở Ngày Mai,2022-07-25,1,188,False,41
7ssVARiCxa9KentfZXhZEr,Tèn Tèn Girls! (feat. Tlinh & Suboi),Suboi,124411,"['vietnamese hip hop', 'vietnamese melodic rap']",Rap Việt Tập 16,2020-11-16,7,190,False,35
4ozlT89zuLoo93Np318Tjr,Cả Ngàn Lời Chúc,Suboi,124411,"['vietnamese hip hop', 'vietnamese melodic rap']",Cả Ngàn Lời Chúc,2021-01-07,1,196,False,34
6IQ4jy1T0Ddkfmo8gfrzL4,Lava,Suboi,124411,"['vietnamese hip hop', 'vietnamese melodic rap']",No Nê,2021-07-15,10,219,False,29
18ce2KQFNxvJx3Oh1bWcTA,N-Sao?,Suboi,124411,"['vietnamese hip hop', 'vietnamese melodic rap']",No Nê,2021-07-15,10,216,False,28
1F8vOQ4ywGF2AnncLD9PYu,Cho Không,Suboi,124411,"['vietnamese hip hop', 'vietnamese melodic rap']",No Nê,2021-07-15,10,201,False,26
1dSml8PHIjLz9s1fx7YRml,Trời Cho,Suboi,124411,"['vietnamese hip hop', 'vietnamese melodic rap']",Trời Cho (feat. Hoàng Touliver),2015-10-28,1,214,False,27
6VL0fVbCuht6fwd1HRXOrJ,Bet On Me,Suboi,124411,"['vietnamese hip hop', 'vietnamese melodic rap']",No Nê,2021-07-15,10,225,True,26
4FAV3tkfo31xZJc0dTdMzO,Best Friend,Suboi,124411,"['vietnamese hip hop', 'vietnamese melodic rap']",No Nê,2021-07-15,10,258,False,25
09WDT0J5iyvt4ZsCULWaRC,Diều,Suboi,124411,"['vietnamese hip hop', 'vietnamese melodic rap']",No Nê,2021-07-15,10,166,False,25
79GqAnQaIxxm4BCzXwEhps,Phía Sau Một Cô Gái (feat. Soobin Hoàng Sơn),Truyền Hình FPT,1249,['v-pop'],Music Home Soobin Hoàng Sơn (feat. Soobin Hoàng Sơn),2021-06-01,12,251,False,29
1bv55HnPVVFhEwSpWPrGQt,Xin Đừng Lặng Im (feat. Soobin Hoàng Sơn),Truyền Hình FPT,1249,['v-pop'],Music Home Soobin Hoàng Sơn (feat. Soobin Hoàng Sơn),2021-06-01,12,255,False,29
6Q9a1RwO1kb3oVmomU06oY,Người Ta Nói / Ánh Nắng Của Anh (Mashup ),Truyền Hình FPT,1249,['v-pop'],Giao Lộ Thời Gian,2022-07-24,9,334,False,29
0RX5eJVvuVQfYo23WbfjaZ,Vệt Nắng - Nếu Ta Không Gặp Nhau,Truyền Hình FPT,1249,['v-pop'],Giao Lộ Thời Gian,2022-07-24,10,335,False,28
2LXsOPGpAjLzS5S3HI3QNW,Chuyến Đi Của Năm (Đi Để Trở Về 2) [feat. Soobin Hoàng Sơn],Truyền Hình FPT,1249,['v-pop'],Music Home Soobin Hoàng Sơn (feat. Soobin Hoàng Sơn),2021-06-01,12,303,False,19
1qOTtBlIKT7OKmTwdVKR9n,Tôi Đi Tìm Tôi,Truyền Hình FPT,1249,['v-pop'],Giao Lộ Thời Gian,2022-07-24,9,318,False,26
2kJOb266eg3keASNDEeOUW,"Là Anh Đó (feat. Bùi Anh Tuấn, Hiền Hồ)",Truyền Hình FPT,1249,['v-pop'],"Music Home Bùi Anh Tuấn ft Hiền Hồ (feat. Bùi Anh Tuấn, Hiền Hồ)",2021-06-01,12,261,False,16
7keuSJeEM7oOmD25VCTt0Q,Anh Chỉ Biết Câm Nín Nghe Tiếng Em Khóc,Truyền Hình FPT,1249,['v-pop'],Giao Lộ Thời Gian,2022-07-24,9,311,False,25
4rVMNwM0bCEm1P4Q3EnzAf,Sợ Yêu,Truyền Hình FPT,1249,['v-pop'],Giao Lộ Thời Gian,2022-07-24,10,254,False,25
3PIcNzPptPYCEGEe1MT8S2,Nếu Ta Còn Yêu Nhau,Truyền Hình FPT,1249,['v-pop'],Giao Lộ Thời Gian,2022-07-24,9,279,False,24
0b3N9S5FHJ4h9k7IsKDVSy,Thiên Đàng,Wowy,83031,"['vietnamese hip hop', 'vietnamese trap']",Thiên Đàng,2020-10-16,1,232,False,47
1SkRelFwwUW5wKw9F15QV0,"Có Chuyện, Cùng Chill",Wowy,83031,"['vietnamese hip hop', 'vietnamese trap']","Có Chuyện, Cùng Chill",2022-07-15,1,230,False,42
5rvn7zGZYmFDq27Y2P7tPu,Tết Real Khum?,Wowy,83031,"['vietnamese hip hop', 'vietnamese trap']",Tết Real Khum?,2022-01-05,1,218,False,38
7fBS3lMEHU3XIzn6lXgH3X,Chim Sẻ Và Dâu Tây (feat. Dế Choắt & Wowy),Wowy,83031,"['vietnamese hip hop', 'vietnamese trap']",Rap Việt Tập 16,2020-11-16,7,208,False,38
0cvjprbjA4oqbfBdKppcr4,Buddha,Wowy,83031,"['vietnamese hip hop', 'vietnamese trap']",Buddha,2012-04-28,1,209,True,34
5fwTTNNOVWIm9CAaDHm0Xn,Trọn Vẹn Nghĩa Tình - Thái Hoàng Remix,Wowy,83031,"['vietnamese hip hop', 'vietnamese trap']",Trọn Vẹn Nghĩa Tình (Thái Hoàng Remix),2022-08-08,1,252,False,27
7g7YRbQSWnKOgMe3uBmtJU,Khu Tôi Không Sống,Wowy,83031,"['vietnamese hip hop', 'vietnamese trap']",Khu Tôi Không Sống,2022-07-04,1,188,False,26
7wZpxK8I978d7z2pHl45qf,Tiền,Wowy,83031,"['vietnamese hip hop', 'vietnamese trap']",Khu***Song (KSS),2018-10-05,7,201,True,22
5F2tYNqdhrRSjOHF2uqqTQ,"Chạy - From ""Ròm""",Wowy,83031,"['vietnamese hip hop', 'vietnamese trap']","Chạy (From ""Ròm"")",2020-07-28,1,223,False,21
5kypBm9f8S1dVUkmB8ZbxO,Hướng Dương,Wowy,83031,"['vietnamese hip hop', 'vietnamese trap']",Hướng Dương,2021-12-31,1,234,False,19
5KYv3kORBKUmVEoqbRRWxt,Từng Là Của Nhau,Bao Anh,444629,['v-pop'],Từng Là Của Nhau,2022-08-30,1,269,False,56
3C53WBsLlQYbP3pWODLrmu,Khúc Giao Mùa,Bao Anh,444629,['v-pop'],Gala Nhạc Việt 7: Tết Trong Tâm Hồn,2016-01-22,17,249,False,43
2PspjfdPnw78FIkUypoluk,Trái Tim Em Cũng Biết Đau,Bao Anh,444629,['v-pop'],Tổng Hợp Ca Khúc MV Hay Nhất Bảo Anh,2017-05-22,9,303,False,39
6TRzFLlvIcH316yUws6aCy,Xuân Mang Tết Đến,Bao Anh,444629,['v-pop'],Xuân Mang Tết Đến,2021-01-28,1,190,False,39
5PUgD8fDi0l9JeleDlap7o,Một Ngày Mùa Đông,Bao Anh,444629,['v-pop'],MOODSHOW 3,2022-03-03,4,166,False,38
0U6MsJybEfho5s80GyI9uN,Don Mua Xuan Ve,Bao Anh,444629,['v-pop'],Don Mua Xuan Ve,2017-01-19,1,259,False,38
3KbpnV3sbRxn8QQkmvkI65,Lắng Nghe Mùa Xuân Về,Bao Anh,444629,['v-pop'],Gala Nhạc Việt 3: Hương Sắc Tết Việt,2014-01-10,16,242,False,37
1nsFL5RxVT3gD3wxCs8b7z,Yêu Một Người Vô Tâm,Bao Anh,444629,['v-pop'],Tổng Hợp Ca Khúc MV Hay Nhất Bảo Anh,2017-05-22,9,310,False,37
6SOAoqbeDQc8x95jKQT9xy,Ngày Tết Quê Em,Bao Anh,444629,['v-pop'],Gala Nhạc Việt 1 - Nhạc Hội Tết Việt,2013-01-12,14,229,False,36
5qkiAOzRP6idRhg7R7Mdtm,Hoa Cỏ Mùa Xuân,Bao Anh,444629,['v-pop'],Gala Nhạc Việt 9: Chúc Tết Mọi Nhà,2017-01-04,14,225,False,35
2FBdQ7Df8Amip2uI1r5a93,Mối Tình Đầu,Thảo Trang,199,[],Mối Tình Đầu,2022-07-07,1,236,False,30
3xMbwAHg0pWvgTN4dTzTlN,Ước Mơ Của Mẹ,Thảo Trang,199,[],Ước Mơ Của Mẹ,2022-10-06,1,268,False,26
5W8hMtW0wrTU4q6eWgmx37,Anh Ơi Ở Lại,Thảo Trang,199,[],Anh Ơi Ở Lại,2022-10-13,1,259,False,23
2dVgccxGewWnvRoX1bLyfE,Mashup Anh Ơi Ở Lại - Đừng Yêu Nữa Em Mệt Rồi,Thảo Trang,199,[],Concert: The Masked Singer Vietnam,2023-01-04,16,319,False,14
65meoRdYteOwM8zz0jZ24Q,Come And Get It,Thảo Trang,199,[],Come And Get It,2018-07-19,1,211,False,9
21LRB4ATiwo0fYNI42Kmji,Cám Ơn Tình Yêu Tôi,Thảo Trang,199,[],Tập 12: The Masked Singer Vietnam,2023-01-04,5,286,False,5
52RJGkcqQA0Q6hzROiT376,Angel In Me,Thảo Trang,199,[],Angel In Me,2022-10-21,1,249,False,5
3etrxTFFcmWV0rgmLhU0Yj,Mashup Anh Ơi Ở Lại - Đừng Yêu Nữa Em Mệt Rồi,Thảo Trang,199,[],Tập 6: The Masked Singer Vietnam,2023-01-04,3,284,False,5
0vGEpuMrnrQrDH26QMEJSn,Hạnh Phúc Máu,Thảo Trang,199,[],Hạnh Phúc Máu,2022-11-16,1,255,False,5
56KVvnfiUFgK8I9O0JoaHS,Ước Mơ Của Mẹ,Thảo Trang,199,[],Tập 12: The Masked Singer Vietnam,2023-01-04,5,271,False,4
6lmJXxTcLTe6bdgwSfTqhO,MOT NGUOI VI EM,WEAN,146083,"['v-pop', 'vietnamese hip hop', 'vietnamese melodic rap']",MOT NGUOI VI EM,2020-09-25,1,211,False,44
4knRFQiLJMMUlP7psJk4kg,AI BIET,WEAN,146083,"['v-pop', 'vietnamese hip hop', 'vietnamese melodic rap']",AI BIET,2019-08-30,1,178,False,43
0OPnFU9UWoQnjrtAOBOLiz,She Said,WEAN,146083,"['v-pop', 'vietnamese hip hop', 'vietnamese melodic rap']",She Said,2019-01-25,1,207,False,42
1j18WxScysqcVZnCSc90nV,Celina,WEAN,146083,"['v-pop', 'vietnamese hip hop', 'vietnamese melodic rap']",Celina,2022-09-09,1,206,False,41
5sDfLKhaLMbVffAmmnIkXc,Chương 2 Của Tương Lai,WEAN,146083,"['v-pop', 'vietnamese hip hop', 'vietnamese melodic rap']",Chương 2 Của Tương Lai,2021-01-08,1,243,False,41
4zKM1dGCOYC2NYN8itGRQz,Retrograde,WEAN,146083,"['v-pop', 'vietnamese hip hop', 'vietnamese melodic rap']",Retrograde,2018-12-24,1,229,False,39
2Od0QwkZrFRyIPJlGb1xNf,Alone,WEAN,146083,"['v-pop', 'vietnamese hip hop', 'vietnamese melodic rap']",Alone,2020-01-10,1,242,False,37
1lNJbioKb7Zue9sf2wcaWN,LAVIE,WEAN,146083,"['v-pop', 'vietnamese hip hop', 'vietnamese melodic rap']",LAVIE,2020-11-13,1,200,False,37
0zwh6OWqVxAZbhUvqFSDA5,Love U So,WEAN,146083,"['v-pop', 'vietnamese hip hop', 'vietnamese melodic rap']",LAVIE,2020-12-18,4,239,False,36
67XDF7KTKW0aBj1Sj3gi6x,I Don't Know,WEAN,146083,"['v-pop', 'vietnamese hip hop', 'vietnamese melodic rap']",LAVIE,2020-12-18,4,247,False,34
5slfXBSwLUc1r49wfKu6rJ,Bonjour Vietnam,Thuỳ Dung,1022,[],Bonjour Vietnam,2021-07-19,2,251,False,24
6F6D65Ch3H8JH33WNU2ljM,Mưa Trên Biển Vắng (Je N'Pourrai Jamais T'oublier),Thuỳ Dung,1022,[],Mưa Trên Biển Vắng (Je N'Pourrai Jamais T'oublier),2021-07-14,1,259,False,22
0VxWNVI2Kpd9CyaHwlWTrz,Xin Chào Việt Nam,Thuỳ Dung,1022,[],Bonjour Vietnam,2021-07-19,2,254,False,22
6NnXabFmfvCxhmS8CjOqcf,Poupée De Cire Poupée De Son,Thuỳ Dung,1022,[],Poupée De Cire Poupée De Son,2021-07-14,1,173,False,22
1UvL1CV3CyZIampgqIKbRi,Mashup Toi jamais L'amour c'est pour rien,Thuỳ Dung,1022,[],Mashup Toi jamais L'amour c'est pour rien,2021-07-23,1,256,False,21
5ylg1HGDMYbTEYsLIlafMa,Bang Bang,Thuỳ Dung,1022,[],Bang Bang,2021-08-12,1,204,False,21
61VjFmM7TUR0MJfY7vVT8N,La Maritza (Dòng Sông Tuổi Nhỏ),Thuỳ Dung,1022,[],La Maritza (Dòng Sông Tuổi Nhỏ),2021-07-19,1,305,False,20
3dnzqR4anmQusnqGB8GJrE,Tuyết Rơi,Thuỳ Dung,1022,[],Tuyết Rơi,2021-07-23,1,323,False,20
7BZxAQhGoHqFOnUZGFOiS8,Aline (Gọi Tên Người Yêu),Thuỳ Dung,1022,[],Aline (Gọi Tên Người Yêu),2021-07-19,1,223,False,19
1RkqIQ5uwEe5Me1SxQ44XO,"Paroles, Paroles",Thuỳ Dung,1022,[],"Paroles, Paroles",2021-07-19,1,206,False,19
65coxKC1JPMqUYVbx616Vj,Đã Biết Sẽ Có Ngày Hôm Qua,Trinh Thang Binh,452313,['v-pop'],Summer Love,2011-09-30,9,271,False,50
43uHryghjKJW07qTEP3DaX,Viết Nên Chuyện Tình,Trinh Thang Binh,452313,['v-pop'],Reply 1990,2021-08-12,2,150,False,49
1Szl9lPaJ750Hn2hRX9QI0,Người Ấy,Trinh Thang Binh,452313,['v-pop'],Ca Sĩ Giấu Mặt,2017-04-04,8,261,False,47
6kSnk1wRjfSV2UcVHGyYx1,Lời Chưa Nói,Trinh Thang Binh,452313,['v-pop'],Summer Love,2011-09-30,9,256,False,46
7CVdUE4KKpZkmHYAGVN0o4,Khác Biệt To Lớn Hơn,Trinh Thang Binh,452313,['v-pop'],Khác Biệt To Lớn Hơn,2022-06-19,1,253,False,43
5tLuEeLBibUSAzDfntdfzC,Cho Đến Khi Trời Đất Sụp Đổ,Trinh Thang Binh,452313,['v-pop'],Reply 1990,2021-08-12,2,157,False,43
1xE5yw2qN2ezUH4rGsHZt1,MỗI Ngày Yêu Em Thêm MộT Chút,Trinh Thang Binh,452313,['v-pop'],MỗI Ngày Yêu Em Thêm MộT Chút,2021-09-06,1,136,False,43
6sR8RE1cyGfpzhF6rTeTkk,Vỡ Tan,Trinh Thang Binh,452313,['v-pop'],Người Ấy,2017-09-25,15,260,False,43
6g8PLSPxqvgynTZV3jV9uQ,Chờ Em Đến Hoa Cũng Tàn,Trinh Thang Binh,452313,['v-pop'],Chờ Em Đến Hoa Cũng Tàn,2021-09-20,1,157,False,42
1BylKrxC94kHMSrFF2ZTOK,Tâm Sự Tuổi 30,Trinh Thang Binh,452313,['v-pop'],The First Show,2022-08-17,13,275,False,41
2tg8L2ls1k19B2SvRKBnJh,Hẹn Ước Từ Hư Vô - Live,Mỹ Tâm,2016378,"['v-pop', 'vietnamese singer-songwriter']",Hẹn Ước Từ Hư Vô (Live),2022-03-02,1,248,False,53
33weHbON0j21ZPUMc0ZKTt,Đúng Cũng Thành Sai,Mỹ Tâm,2016378,"['v-pop', 'vietnamese singer-songwriter']",Đúng Cũng Thành Sai,2020-10-01,1,287,False,49
1rJyVbXb3njXbN3lokllKf,Người Hãy Quên Em Đi,Mỹ Tâm,2016378,"['v-pop', 'vietnamese singer-songwriter']",Tâm 9,2017-12-06,13,232,False,48
5U5aFzSWZVGe5gg8eCc8ft,Nơi Mình Dừng Chân (Nhạc Phim Chị Trợ Lý Của Anh),Mỹ Tâm,2016378,"['v-pop', 'vietnamese singer-songwriter']",Nơi Mình Dừng Chân (Nhạc Phim Chị Trợ Lý Của Anh),2019-01-25,1,242,False,47
5UeD0rVFJXXl3HGjKiZbrt,Muộn Màng Là Từ Lúc,Mỹ Tâm,2016378,"['v-pop', 'vietnamese singer-songwriter']",Tâm 9,2017-12-06,13,235,False,47
2IRMoSVwaDxBw0huQabuKY,Đừng Hỏi Em,Mỹ Tâm,2016378,"['v-pop', 'vietnamese singer-songwriter']",Tâm 9,2017-12-06,13,263,False,45
1aw1KeS9sT1mKPzs2hfqCz,Nếu Anh Đi,Mỹ Tâm,2016378,"['v-pop', 'vietnamese singer-songwriter']",Tâm 9,2017-12-06,13,252,False,44
20dRfYNGWwxE9ryZ0bygDG,Chuyện Như Chưa Bắt Đầu,Mỹ Tâm,2016378,"['v-pop', 'vietnamese singer-songwriter']",Chuyện Như Chưa Bắt Đầu,2013-12-02,1,269,False,42
3ZjHWaqv4LZFrdISGqaj2r,Tay Vớt Ánh Trăng - Live,Mỹ Tâm,2016378,"['v-pop', 'vietnamese singer-songwriter']",Tay Vớt Ánh Trăng (Live),2022-04-08,1,260,False,42
2P9M7q49JXnwiab4TosOpW,Anh Đợi Em Được Không,Mỹ Tâm,2016378,"['v-pop', 'vietnamese singer-songwriter']",Anh Đợi Em Được Không,2019-09-24,1,277,False,41
5cml547MByVlaVrKU2lJTg,Em iu,Andree Right Hand,84850,"['vietnamese hip hop', 'vietnamese trap']",Em iu,2022-01-30,1,180,True,51
255vSRpVq5YYKBJiem1BVx,Chơi Như Tụi Mỹ,Andree Right Hand,84850,"['vietnamese hip hop', 'vietnamese trap']",Chơi Như Tụi Mỹ,2022-12-30,1,161,False,49
1VBJ2QBJjgbcGgsXJbHslR,CLME,Andree Right Hand,84850,"['vietnamese hip hop', 'vietnamese trap']",CLME,2019-07-15,1,240,True,47
