name,artist,artist_followers,artist_genres,album,release_date,album_total_tracks,duration,explicit,popularity
Tân Cổ Cánh Hoa Yêu,Vọng Cổ Việt Nam,84,[],Tân Cổ Cánh Hoa Yêu,2021-05-11,1,461098,False,14
Tân Cổ Ru Nửa Vầng Trăng,Vọng Cổ Việt Nam,84,[],Tân Cổ Ru Nửa Vầng Trăng,2021-01-11,1,517289,False,11
Tân Cổ Sao Út Nỡ Vội Lấy Chồng,Vọng Cổ Việt Nam,84,[],Tân Cổ Sao Út Nỡ Vội Lấy Chồng,2021-01-11,1,529642,False,11
Tân Cổ Con Đò Lỡ Hẹn,Vọng Cổ Việt Nam,84,[],Tân Cổ Con Đò Lỡ Hẹn,2021-10-11,1,557823,False,10
Tân Cổ Buồn Trong Kỷ Niệm,Vọng Cổ Việt Nam,84,[],Tân Cổ Buồn Trong Kỷ Niệm,2021-10-11,1,556309,False,9
Tân Cổ Chim Trắng Mồ Côi,Vọng Cổ Việt Nam,84,[],Tân Cổ Chim Trắng Mồ Côi,2021-10-11,1,538517,False,9
Tân Cổ Quán Nửa Khuya,Vọng Cổ Việt Nam,84,[],Tân Cổ Quán Nửa Khuya,2021-01-11,1,509781,False,9
Tân Cổ Tiền Thắng Tình Thua,Vọng Cổ Việt Nam,84,[],Tân Cổ Tiền Thắng Tình Thua,2021-01-11,1,455061,False,7
Tân Cổ Đêm Mơ Em Hát Dân Ca,Vọng Cổ Việt Nam,84,[],Tân Cổ Đêm Mơ Em Hát Dân Ca,2021-10-11,1,526741,False,7
Trích Đoạn Máu Nhuộm Sân Chùa,Vọng Cổ Việt Nam,84,[],Trích Đoạn Máu Nhuộm Sân Chùa,2021-10-11,1,698282,False,7
Hơn Em Chỗ Nào,Thùy Chi,473376,"['v-pop', 'vietnamese singer-songwriter']",Hơn Em Chỗ Nào,2022-12-05,2,295750,False,52
Phiến Lá Tĩnh Lặng,Thùy Chi,473376,"['v-pop', 'vietnamese singer-songwriter']",Phiến Lá Tĩnh Lặng,2021-04-20,1,307621,False,45
"Giữ Em Đi - From ""Mùa Oải Hương Năm Ấy""",Thùy Chi,473376,"['v-pop', 'vietnamese singer-songwriter']",Mua Oai Huong Nam Ay - Lavender's Love Story (Original Television Soundtrack),2014,2,284457,False,42
Xe Đạp,Thùy Chi,473376,"['v-pop', 'vietnamese singer-songwriter']",Tuổi Hoa Mộng,2017-09-25,12,285457,False,42
Quê Tôi,Thùy Chi,473376,"['v-pop', 'vietnamese singer-songwriter']",The Best Of Thùy Chi 3,2017-05-31,9,269531,False,37
Con Đường Hạnh Phúc,Thùy Chi,473376,"['v-pop', 'vietnamese singer-songwriter']",The Best Of Thùy Chi 2,2012-12-15,14,303177,False,36
Giấc Mơ Trưa,Thùy Chi,473376,"['v-pop', 'vietnamese singer-songwriter']",The Best Of Thùy Chi 1,2012-05-10,15,341106,False,36
Nói Chia Tay Thật Khó (feat. Trấn Thành),Thùy Chi,473376,"['v-pop', 'vietnamese singer-songwriter']",Nói Chia Tay Thật Khó,2020-10-20,2,331084,False,34
"Không Sao Mà, Em Đây Rồi (Thong Dong Mà Hát)",Thùy Chi,473376,"['v-pop', 'vietnamese singer-songwriter']","Không Sao Mà, Em Đây Rồi (Thong Dong Mà Hát)",2022-06-20,1,184385,False,32
Mong Manh Tình Về,Thùy Chi,473376,"['v-pop', 'vietnamese singer-songwriter']",The Best Of Thùy Chi 3,2017-05-31,9,307278,False,31
Vì Anh Đâu Có Biết,Vũ.,1401707,"['indie viet', 'rock viet', 'v-pop', 'vietnamese singer-songwriter']",Vì Anh Đâu Có Biết,2022-08-04,1,241919,False,64
Anh Nhớ Ra (feat. TRANG),Vũ.,1401707,"['indie viet', 'rock viet', 'v-pop', 'vietnamese singer-songwriter']",Một Vạn Năm,2022-09-09,9,276500,False,59
Lạ Lùng,Vũ.,1401707,"['indie viet', 'rock viet', 'v-pop', 'vietnamese singer-songwriter']",Lạ Lùng,2016-12-24,1,261616,False,57
Bước Qua Nhau,Vũ.,1401707,"['indie viet', 'rock viet', 'v-pop', 'vietnamese singer-songwriter']",Một Vạn Năm,2022-09-09,9,257647,False,55
Cô Ta,Vũ.,1401707,"['indie viet', 'rock viet', 'v-pop', 'vietnamese singer-songwriter']",Một Vạn Năm,2022-09-09,9,214500,False,55
Bước Qua Mùa Cô Đơn,Vũ.,1401707,"['indie viet', 'rock viet', 'v-pop', 'vietnamese singer-songwriter']",Một Vạn Năm,2022-09-09,9,278823,False,54
Đông Kiếm Em,Vũ.,1401707,"['indie viet', 'rock viet', 'v-pop', 'vietnamese singer-songwriter']",Đông Kiếm Em,2015-03-28,1,246043,False,51
Phút Ban Đầu,Vũ.,1401707,"['indie viet', 'rock viet', 'v-pop', 'vietnamese singer-songwriter']",Phút Ban Đầu,2013-03-28,1,243226,False,50
Chậm Lại,Vũ.,1401707,"['indie viet', 'rock viet', 'v-pop', 'vietnamese singer-songwriter']",Một Vạn Năm,2022-09-09,9,223384,False,47
Happy For You (feat. Vũ.),Vũ.,1401707,"['indie viet', 'rock viet', 'v-pop', 'vietnamese singer-songwriter']",Happy For You (feat. Vũ.),2021-07-02,2,226402,False,46
Cheri Cheri Lady - Remix,IOF Viet Nam,95,[],Cheri Cheri Lady (Remix),2022-07-07,1,193073,False,21
Ngày Chưa Giông Bão - Remix,IOF Viet Nam,95,[],Ngày Chưa Giông Bão (Remix),2022-06-29,1,202659,False,14
Lửng Lơ - Remix,IOF Viet Nam,95,[],Lửng Lơ (Remix),2022-07-07,1,258194,False,13
Xa Vắng - Remix,IOF Viet Nam,95,[],Xa Vắng (Remix),2022-07-24,1,142106,False,10
Tay Trái Chỉ Trăng - Remix,IOF Viet Nam,95,[],Tay Trái Chỉ Trăng (Remix),2022-06-28,1,243880,False,9
Mang Tiền Về Cho Vợ,IOF Viet Nam,95,[],Mang Tiền Về Cho Vợ,2022-01-17,1,109532,False,4
Những Lời Dối Gian - Remix,IOF Viet Nam,95,[],Những Lời Dối Gian (Remix),2022-06-28,1,281914,False,2
Em Tên Thiên Lý - Võ Tuấn Kiệt Remix,IOF Viet Nam,95,[],Em Tên Thiên Lý (Võ Tuấn Kiệt Remix),2022-04-14,1,121155,False,1
Ngôi Sao Cô Đơn,Jack - J97,444355,['v-pop'],Ngôi Sao Cô Đơn,2022-07-19,1,275583,False,47
Hoa Hải Đường,Jack - J97,444355,['v-pop'],Hoa Hải Đường,2020-09-22,1,229589,False,45
Đom Đóm,Jack - J97,444355,['v-pop'],Đom Đóm,2020-12-26,1,324949,False,43
Ngôi Sao Cô Đơn - Lo-fi Ver.,Jack - J97,444355,['v-pop'],Ngôi Sao Cô Đơn (Lo-fi Ver.),2022-07-30,1,284165,False,36
Là 1 Thằng Con Trai,Jack - J97,444355,['v-pop'],Là 1 Thằng Con Trai,2021-01-05,1,246428,False,34
hồng nhan - Piano slowed version,Jack - J97,444355,['v-pop'],hồng nhan (Piano slowed version),2022-02-25,1,384174,False,30
Đi Về Nhà,JustaTee,620269,"['v-pop', 'vietnamese hip hop', 'vietnamese melodic rap']",Đi Về Nhà,2020-12-20,1,200000,False,60
2AM,JustaTee,620269,"['v-pop', 'vietnamese hip hop', 'vietnamese melodic rap']",2AM,2022-05-10,1,258281,False,57
Thằng Điên,JustaTee,620269,"['v-pop', 'vietnamese hip hop', 'vietnamese melodic rap']",Thằng Điên,2022-07-11,1,234000,False,57
Forget About Her,JustaTee,620269,"['v-pop', 'vietnamese hip hop', 'vietnamese melodic rap']",KOSMIK,2022-10-31,11,217500,False,56
A Veil of Mist,JustaTee,620269,"['v-pop', 'vietnamese hip hop', 'vietnamese melodic rap']",KOSMIK,2022-10-31,11,302000,False,50
Vì Yêu Cứ Đâm Đầu,JustaTee,620269,"['v-pop', 'vietnamese hip hop', 'vietnamese melodic rap']",Vì Yêu Cứ Đâm Đầu,2019-11-10,1,231000,False,50
Đã Lỡ Yêu Em Nhiều,JustaTee,620269,"['v-pop', 'vietnamese hip hop', 'vietnamese melodic rap']",Đã Lỡ Yêu Em Nhiều,2022-07-11,1,261105,False,50
Làm Gì Phải Hốt,JustaTee,620269,"['v-pop', 'vietnamese hip hop', 'vietnamese melodic rap']",Làm Gì Phải Hốt,2020-01-05,1,189296,False,49
Đố em biết anh đang nghĩ gì,JustaTee,620269,"['v-pop', 'vietnamese hip hop', 'vietnamese melodic rap']",Đố em biết anh đang nghĩ gì,2018-09-08,1,246236,False,49
Bâng Khuâng,JustaTee,620269,"['v-pop', 'vietnamese hip hop', 'vietnamese melodic rap']",Bâng Khuâng,2020-08-21,1,313157,False,46
Nơi Lòng Nhân Trải Bước Thành Công,Chubb Life Việt Nam,2,[],Nơi Lòng Nhân Trải Bước Thành Công,2022-10-16,1,214864,False,13
Vì Bạn Là Cả Thế Giới (Chubb Life Việt Nam),Chubb Life Việt Nam,2,[],Vì Bạn Là Cả Thế Giới (Chubb Life Việt Nam),2022-04-27,1,180300,False,4
Ai Mang Cô Đơn Đi,K-ICM,101788,['v-pop'],Ai Mang Cô Đơn Đi,2020-08-28,1,221199,False,39
Buồn Của Anh,K-ICM,101788,['v-pop'],Buồn Của Anh,2019-02-26,1,288008,False,34
Con Trai Cưng,K-ICM,101788,['v-pop'],K-ICM Collections,2020-09-06,5,192386,False,33
Đã Từng Có Nhau,K-ICM,101788,['v-pop'],Đã Từng Có Nhau,2022-07-09,1,290411,False,32
Chơi Vơi,K-ICM,101788,['v-pop'],Chơi Vơi,2022-04-20,1,278400,False,26
Lệ Duyên Tình - Verion Lofi,K-ICM,101788,['v-pop'],Lệ Duyên Tình (Version Lofi),2021-05-19,1,243846,False,23
Hoa Không Hương,K-ICM,101788,['v-pop'],Hoa Không Hương,2022-07-12,1,260294,False,23
Buồn Của Anh (K-ICM Remix),K-ICM,101788,['v-pop'],Buồn Của Anh (K-ICM Remix),2018-08-01,2,340526,False,23
Túy Họa,K-ICM,101788,['v-pop'],Túy Họa,2020-07-03,1,256800,False,22
Liếc Mắt Đưa Tình (Ogles),K-ICM,101788,['v-pop'],Liếc Mắt Đưa Tình (Ogles),2020-11-30,1,214672,False,21
Vì Anh Đâu Có Biết,Madihu,77497,"['indie viet', 'v-pop', 'vietnamese melodic rap']",Vì Anh Đâu Có Biết,2022-08-04,1,241919,False,64
Có Em (feat. Low G),Madihu,77497,"['indie viet', 'v-pop', 'vietnamese melodic rap']",Có Em (feat. Low G),2022-04-22,1,218512,False,63
Có Khi (feat. Low G),Madihu,77497,"['indie viet', 'v-pop', 'vietnamese melodic rap']",Có Khi (feat. Low G),2022-10-13,1,259333,False,54
hai triệu năm - Madihu mix,Madihu,77497,"['indie viet', 'v-pop', 'vietnamese melodic rap']",hai triệu năm (Madihu mix),2019-09-11,1,209735,False,43
Đố em biết anh đang nghĩ gì - Remix,Madihu,77497,"['indie viet', 'v-pop', 'vietnamese melodic rap']",Đố em biết anh đang nghĩ gì (Remix),2018-12-27,1,228037,False,40
EM ĐÂU CẦN (feat. tlinh),Madihu,77497,"['indie viet', 'v-pop', 'vietnamese melodic rap']",EM ĐÂU CẦN (feat. tlinh),2022-05-08,1,195745,False,38
Có Em - Solo Version,Madihu,77497,"['indie viet', 'v-pop', 'vietnamese melodic rap']",Có,2022-10-20,6,217742,False,38
Thôi hẹn em,Madihu,77497,"['indie viet', 'v-pop', 'vietnamese melodic rap']",Bụi Mơ,2020-12-16,5,231054,False,35
Vườn mây,Madihu,77497,"['indie viet', 'v-pop', 'vietnamese melodic rap']",Bụi Mơ,2020-12-16,5,217666,False,35
Hai người xa,Madihu,77497,"['indie viet', 'v-pop', 'vietnamese melodic rap']",nguoiMaiDichcodon,2016-12-30,6,285433,False,30
Người Tình Mùa Đông,Jack Viet Nam,435,[],Tình Nồng,2020-01-01,5,225420,False,12
Người Tình Mùa Đông,Jack Viet Nam,435,[],Tình Nồng,2020-01-01,5,199275,False,4
Lâu Đài Tình Ái,Mai Chí Công,199,[],Lâu Đài Tình Ái,2021-12-16,1,260458,False,17
Thương Cả Khi Trong Mơ,Mai Chí Công,199,[],Thương Cả Khi Trong Mơ,2021-07-30,1,155917,False,4
Một Lần Dang Dở,Mai Chí Công,199,[],Một Lần Dang Dở,2021-12-16,1,89609,False,4
Hoàng Kim,Mai Chí Công,199,[],Bài Hát Hay Nhất - Big Song Big Deal (Tập 4),2022-10-23,5,179000,False,3
Tìm Được Tình Yêu Ở Một Nơi Xa,Mai Chí Công,199,[],Bài Hát Hay Nhất - Big Song Big Deal (Tập 9),2022-11-27,5,150480,False,2
Đây Là Một Bài Hát Tết,Mai Chí Công,199,[],Đây Là Một Bài Hát Tết,2022-01-24,1,175615,False,2
Mượn Một Giấc Mơ,Mai Chí Công,199,[],Bài Hát Hay Nhất - Big Song Big Deal (Tập 12),2022-12-19,5,179560,False,1
LẦN CUỐI (đi bên em xót xa người ơi),Ngọt,399186,"['indie viet', 'rock viet', 'v-pop']",3 (tuyển tập nhạc Ngọt mới trẻ sôi động 2019),2019-06-10,14,222846,False,55
Cho Tôi Lang Thang,Ngọt,399186,"['indie viet', 'rock viet', 'v-pop']",Cho Tôi Lang Thang,2018-03-27,1,258784,False,54
Đá tan,Ngọt,399186,"['indie viet', 'rock viet', 'v-pop']",Gieo,2022-11-25,11,202166,False,54
Thấy Chưa,Ngọt,399186,"['indie viet', 'rock viet', 'v-pop']",Gieo,2022-11-25,11,232204,False,48
để quên,Ngọt,399186,"['indie viet', 'rock viet', 'v-pop']",để quên,2021-04-21,1,170666,False,52
Em Dạo Này,Ngọt,399186,"['indie viet', 'rock viet', 'v-pop']",Ng'bthg,2017-09-23,8,201828,False,50
Điểm Đến Cuối Cùng,Ngọt,399186,"['indie viet', 'rock viet', 'v-pop']",Gieo,2022-11-25,11,213667,False,49
Bạn thỏ tivi nhỏ,Ngọt,399186,"['indie viet', 'rock viet', 'v-pop']",Gieo,2022-11-25,11,268845,False,49
Mất Tích,Ngọt,399186,"['indie viet', 'rock viet', 'v-pop']",Gieo,2022-11-25,11,271923,False,49
Em Trong Đầu,Ngọt,399186,"['indie viet', 'rock viet', 'v-pop']",Gieo,2022-11-25,11,198222,False,48
"Hồ Chí Minh Đẹp Nhất Tên Người - ""Khát Vọng Mùa Xuân"" Mừng Đảng, Mừng Xuân Nhân Dần 2022",Học Viện Âm Nhạc Quốc Gia Việt Nam,1,[],"Ngày Tết Quê Em (""Khát Vọng Mùa Xuân"" Mừng Đảng, Mừng Xuân Nhân Dần 2022)",2022-09-08,13,271000,False,0
Cùng Nhau Đi Hồng Binh,Học Viện Âm Nhạc Quốc Gia Việt Nam,1,[],Bài Ca Thiếu Niên Du Kích Đình Bảng (Lễ Kỷ Niệm 70 Năm Thành Lập Đội Thiếu Niên Du Kích Đình Bảng),2022-09-06,9,223120,False,0
Diệt Phát Xít - Lễ Kỷ Niệm 110 Năm Ngày Sinh Tổng Bí Thư Nguyễn Văn Cừ,Học Viện Âm Nhạc Quốc Gia Việt Nam,1,[],Diệt Phát Xít (Lễ Kỷ Niệm 110 Năm Ngày Sinh Tổng Bí Thư Nguyễn Văn Cừ),2022-08-18,1,254028,False,0
Nguyệt Hạ Tiền Hoa (Hồ Quang Hiếu),Nam Viet Media,5,[],Nguyệt Hạ Tiền Hoa (Hồ Quang Hiếu),2020-11-16,1,205483,False,3
Việt Nam Trong Tôi Là,Phạm Linh Phương,73,[],Việt Nam Trong Tôi Là,2021-03-16,1,214459,False,28
Mẹ Yêu Con,Phạm Linh Phương,73,[],Mẹ Yêu Con,2020-03-16,1,221379,False,19
Hello Việt Nam,Phạm Linh Phương,73,[],Hello Việt Nam,2021-03-16,1,272277,False,19
Cha Và Con Gái,Phạm Linh Phương,73,[],Cha Và Con Gái,2021-03-16,1,393880,False,11
Bà Tôi,Phạm Linh Phương,73,[],Bà Tôi,2020-03-16,1,382084,False,11
This Love,Phạm Linh Phương,73,[],This Love,2021-03-16,1,226176,False,6
Nâng Được Thì Buông Được,Phạm Linh Phương,73,[],Nâng Được Thì Buông Được,2021-03-16,1,237029,False,3
Cha Già Rồi Đúng Không,Phạm Linh Phương,73,[],Cha Già Rồi Đúng Không,2021-03-16,1,287323,False,2
Cây Vĩ Cầm,Phạm Linh Phương,73,[],Cây Vĩ Cầm,2021-03-16,1,314008,False,2
Bước Đi Không Dừng Lại,Phạm Linh Phương,73,[],Bước Đi Không Dừng Lại,2021-03-16,1,340009,False,2
Đi Về Nhà,Đen,2903069,"['indie viet', 'v-pop', 'vietnamese hip hop', 'vietnamese trap']",Đi Về Nhà,2020-12-20,1,200000,False,60
Lối Nhỏ,Đen,2903069,"['indie viet', 'v-pop', 'vietnamese hip hop', 'vietnamese trap']",Lối Nhỏ,2019-10-21,1,252953,False,59
Bài Này Chill Phết,Đen,2903069,"['indie viet', 'v-pop', 'vietnamese hip hop', 'vietnamese trap']",Bài Này Chill Phết,2019,1,276000,False,55
Cho Tôi Lang Thang,Đen,2903069,"['indie viet', 'v-pop', 'vietnamese hip hop', 'vietnamese trap']",Cho Tôi Lang Thang,2018-03-27,1,258784,False,54
Đưa Nhau Đi Trốn - Chill Version,Đen,2903069,"['indie viet', 'v-pop', 'vietnamese hip hop', 'vietnamese trap']",Đưa Nhau Đi Trốn (Chill Version),2015-09-11,1,241958,False,52
Ai muốn nghe không,Đen,2903069,"['indie viet', 'v-pop', 'vietnamese hip hop', 'vietnamese trap']",Ai muốn nghe không,2022-06-12,1,307500,False,52
Cho Mình Em,Đen,2903069,"['indie viet', 'v-pop', 'vietnamese hip hop', 'vietnamese trap']",Cho Mình Em,2021-04-01,1,206400,False,52
Diễn viên tồi,Đen,2903069,"['indie viet', 'v-pop', 'vietnamese hip hop', 'vietnamese trap']",Diễn viên tồi,2022-09-13,1,349793,False,51
Trốn Tìm,Đen,2903069,"['indie viet', 'v-pop', 'vietnamese hip hop', 'vietnamese trap']",Trốn Tìm,2021-05-15,1,248870,False,50
Vì Yêu Cứ Đâm Đầu,Đen,2903069,"['indie viet', 'v-pop', 'vietnamese hip hop', 'vietnamese trap']",Vì Yêu Cứ Đâm Đầu,2019-11-10,1,231000,False,50
Tâm Tình Hiến Dâng,Cộng Đồng Công Giáo Việt Nam Montréal,54,[],Ca nguyện Tri ân (40 Năm Hồng Ân),2020-01-07,13,313229,False,1
Tán Tụng Hồng Ân,Cộng Đồng Công Giáo Việt Nam Montréal,54,[],Ca nguyện Tri ân (40 Năm Hồng Ân),2020-01-07,13,292852,False,0
Khúc Ca Tạ Ơn,Cộng Đồng Công Giáo Việt Nam Montréal,54,[],Ca nguyện Tri ân (40 Năm Hồng Ân),2020-01-07,13,275806,False,0
Gió Thánh Linh Thổi Đến,Cộng Đồng Công Giáo Việt Nam Montréal,54,[],Ca nguyện Tri ân (40 Năm Hồng Ân),2020-01-07,13,334721,False,0
Khúc Cảm Tạ,Cộng Đồng Công Giáo Việt Nam Montréal,54,[],Ca nguyện Tri ân (40 Năm Hồng Ân),2020-01-07,13,346493,False,0
"Chercher Avec Toi, Marie",Cộng Đồng Công Giáo Việt Nam Montréal,54,[],Ca nguyện Tri ân (40 Năm Hồng Ân),2020-01-07,13,274232,False,0
Lời Tri Ân,Cộng Đồng Công Giáo Việt Nam Montréal,54,[],Ca nguyện Tri ân (40 Năm Hồng Ân),2020-01-07,13,120980,False,0
Yêu Con Đời Đời,Cộng Đồng Công Giáo Việt Nam Montréal,54,[],Ca nguyện Tri ân (40 Năm Hồng Ân),2020-01-07,13,236093,False,0
Magnificat Ave Maria,Cộng Đồng Công Giáo Việt Nam Montréal,54,[],Ca nguyện Tri ân (40 Năm Hồng Ân),2020-01-07,13,315078,False,0
Hát Lên Hỡi Thế Trần,Cộng Đồng Công Giáo Việt Nam Montréal,54,[],Ca nguyện Tri ân (40 Năm Hồng Ân),2020-01-07,13,266768,False,0
Việt Nam Ơi,Minh Beta,143,[],Việt Nam Ơi,2020-05-08,1,248833,False,23
Shay Nắnggg,AMEE,829418,['v-pop'],Shay Nắnggg,2022-06-06,1,208301,False,53
từ thích thích thành thương thương,AMEE,829418,['v-pop'],dreAMEE (acoustic),2020-12-15,7,204230,False,52
thay mọi cô gái yêu anh,AMEE,829418,['v-pop'],thay mọi cô gái yêu anh,2022-02-06,1,215257,False,52
hai mươi hai (22),AMEE,829418,['v-pop'],hai mươi hai (22),2022-05-25,1,238986,False,51
trời giấu trời mang đi,AMEE,829418,['v-pop'],dreAMEE,2020-06-28,10,253500,False,51
đen đá không đường,AMEE,829418,['v-pop'],dreAMEE,2020-06-28,10,180500,False,49
Em Bé,AMEE,829418,['v-pop'],Em Bé,2020-09-22,1,192000,False,49
"ex's hate me, Pt. 2",AMEE,829418,['v-pop'],dreAMEE,2020-06-28,10,216500,False,47
sao anh chưa về nhà,AMEE,829418,['v-pop'],dreAMEE,2020-06-28,10,244000,False,46
nàng thơ... trời giấu trời mang đi,AMEE,829418,['v-pop'],dreAMEE (acoustic),2020-12-15,7,262150,False,45
Dep dam giao dâu,Théâtre National du Viet-Nam,54,"['viet instrumental', 'vietnamese traditional']",Viet-Nam : Instruments et ensembles de musique traditionnelle,1995,8,333687,False,0
Vong cô,Théâtre National du Viet-Nam,54,"['viet instrumental', 'vietnamese traditional']",Viet-Nam : Instruments et ensembles de musique traditionnelle,1995,8,370693,False,0
"Nam xuân, nam ai, trông ai",Théâtre National du Viet-Nam,54,"['viet instrumental', 'vietnamese traditional']",Viet-Nam : Instruments et ensembles de musique traditionnelle,1995,8,309705,False,0
Châu Van (Chants de possession),Théâtre National du Viet-Nam,54,"['viet instrumental', 'vietnamese traditional']",Viet-Nam : Instruments et ensembles de musique traditionnelle,1995,8,501549,False,0
Pièce xang xê,Théâtre National du Viet-Nam,54,"['viet instrumental', 'vietnamese traditional']",Viet-Nam : Instruments et ensembles de musique traditionnelle,1995,8,367519,False,0
Tam tâu tuông,Théâtre National du Viet-Nam,54,"['viet instrumental', 'vietnamese traditional']",Viet-Nam : Instruments et ensembles de musique traditionnelle,1995,8,456822,False,0
Solo de six tambourins,Théâtre National du Viet-Nam,54,"['viet instrumental', 'vietnamese traditional']",Viet-Nam : Instruments et ensembles de musique traditionnelle,1995,8,200617,False,0
Trông Phu Thuy (Le tambour du sorcier),Théâtre National du Viet-Nam,54,"['viet instrumental', 'vietnamese traditional']",Viet-Nam : Instruments et ensembles de musique traditionnelle,1995,8,153223,False,0
Cô Gái Việt Nam,Khả Ngân,463,[],Cô Gái Việt Nam,2020-01-01,1,198461,False,11
"Em Đau Lòng Thế, Anh Vừa Lòng Chưa",Khả Ngân,463,[],"Em Đau Lòng Thế, Anh Vừa Lòng Chưa",2020-08-07,1,274000,False,7
Va Vào Giai Điệu Này (feat. RPT MCK),RAP VIỆT,954108,"['v-pop', 'vietnamese hip hop', 'vietnamese melodic rap']",Rap Việt Tập 15,2020-11-08,8,197209,False,49
Dân Chơi Xóm (feat. RPT MCK & JustaTee),RAP VIỆT,954108,"['v-pop', 'vietnamese hip hop', 'vietnamese melodic rap']",Rap Việt Tập 16,2020-11-16,7,153402,False,45
"Giàu Vì Bạn, Sang Vì Vợ (feat. RPT MCK)",RAP VIỆT,954108,"['v-pop', 'vietnamese hip hop', 'vietnamese melodic rap']",Rap Việt Tập 13,2020-10-25,6,223446,False,41
101520 (feat. Sol7 & prettyXIX),RAP VIỆT,954108,"['v-pop', 'vietnamese hip hop', 'vietnamese melodic rap']",Rap Việt Season 2 - Tập 10,2021-12-22,4,193846,False,41
CẢM NHẬN (feat. Seachains),RAP VIỆT,954108,"['v-pop', 'vietnamese hip hop', 'vietnamese melodic rap']",Rap Việt Season 2 - Tập 1,2021-10-18,7,177684,False,40
Anh Vẫn OK (feat. RPT MCK),RAP VIỆT,954108,"['v-pop', 'vietnamese hip hop', 'vietnamese melodic rap']","Rap Việt, Vòng 1",2020-10-08,29,195789,False,40
Tiền Nhiều Để Làm Gì (feat. Gducky),RAP VIỆT,954108,"['v-pop', 'vietnamese hip hop', 'vietnamese melodic rap']",Rap Việt Tập 12,2020-10-19,6,248571,False,39
BACK TO HOMETOWN (TRỞ VỀ QUÊ NHÀ) [feat. Sol7],RAP VIỆT,954108,"['v-pop', 'vietnamese hip hop', 'vietnamese melodic rap']",Rap Việt Season 2 - Tập 3,2021-11-01,8,176000,False,39
"Đây Là Rap Việt (feat. Wowy, Karik, Suboi, Binz, Rhymastic & JustaTee)",RAP VIỆT,954108,"['v-pop', 'vietnamese hip hop', 'vietnamese melodic rap']","Rap Việt, Vòng 1",2020-10-08,29,180600,False,38
SÀI GÒN CÓ EM (feat. Blacka),RAP VIỆT,954108,"['v-pop', 'vietnamese hip hop', 'vietnamese melodic rap']",Rap Việt Season 2 - Tập 2,2021-10-25,7,145428,False,37
Trông Phu Thuy (Le tambour du sorcier),Théâtre Nationel du Viet-Nam,6,[],Percussions du Monde,2004-09-15,17,153244,False,1
Gió Đánh Đò Đưa,Tạ Quang Thắng,2579,['vietnamese singer-songwriter'],Gió Đánh Đò Đưa,2019-07-10,1,216279,False,38
Vội Vàng,Tạ Quang Thắng,2579,['vietnamese singer-songwriter'],Vội Vàng,2019-05-27,1,235462,False,29
Sống Như Những Đoá Hoa,Tạ Quang Thắng,2579,['vietnamese singer-songwriter'],Sống Như Những Đoá Hoa,2013-10-27,1,269538,False,26
Em Về Tinh Khôi,Tạ Quang Thắng,2579,['vietnamese singer-songwriter'],Em Về Tinh Khôi,2019-07-09,1,331702,False,26
Điều Tuyệt Vời Nhất Trên Đời,Tạ Quang Thắng,2579,['vietnamese singer-songwriter'],Điều Tuyệt Vời Nhất Trên Đời,2019-06-21,1,254536,False,23
Lá Cờ,Tạ Quang Thắng,2579,['vietnamese singer-songwriter'],Country Rock (The First Album),2012-05-31,8,324131,False,19
Như Loài Mèo,Tạ Quang Thắng,2579,['vietnamese singer-songwriter'],The Other Side,2019-07-15,17,214804,False,19
Trường Sơn Đông Trường Sơn Tây,Tạ Quang Thắng,2579,['vietnamese singer-songwriter'],The Other Side,2019-07-15,17,277128,False,16
Đi Để Thêm Yêu Việt Nam,Tạ Quang Thắng,2579,['vietnamese singer-songwriter'],Ở Giữa Cuộc Đời,2022-01-14,8,241370,False,14
Hát Về Anh,Tạ Quang Thắng,2579,['vietnamese singer-songwriter'],Hát Về Anh,2020-04-29,1,318895,False,13
3107 3,W/N,399670,"['indie viet', 'v-pop']","3107 3 (feat. Nâu, titie, Dươngg)",2021-07-31,1,240000,False,60
3 1 0 7 (feat. Duongg & Nâu),W/N,399670,"['indie viet', 'v-pop']",3 1 0 7 (feat. Duongg & Nâu),2020-05-11,1,232258,False,58
Crush 2,W/N,399670,"['indie viet', 'v-pop']",Crush 2,2019-12-07,1,119587,False,55
3 1 0 7 - 2 (feat. W/N & Nau),W/N,399670,"['indie viet', 'v-pop']",3 1 0 7 - 2 (feat. W/N & Nau),2021-02-04,1,268524,False,55
"3107 4 (feat. Erik, Nâu)",W/N,399670,"['indie viet', 'v-pop']","3107 4 (feat. Erik, Nâu)",2022-07-31,1,213913,False,52
"3 1 0 7 7 - W/N ft. ( titie, Duongg )",W/N,399670,"['indie viet', 'v-pop']","3 1 0 7 7 - W/N ft. ( titie, Duongg )",2021-10-31,1,211846,False,46
Crush,W/N,399670,"['indie viet', 'v-pop']",Crush,2021-08-29,1,198269,False,43
Tương 3+1,W/N,399670,"['indie viet', 'v-pop']",Tương 3+1,2021-11-30,1,244000,False,40
Lenlala (feat. Tezdy & Nhi),W/N,399670,"['indie viet', 'v-pop']",Lenlala (feat. Tezdy & Nhi),2020-06-23,1,138352,False,35
"Thiên Đường Cô Đơn (feat. W/N, Hino)",W/N,399670,"['indie viet', 'v-pop']","Thiên Đường Cô Đơn (feat. W/N, Hino)",2021-10-05,1,202682,False,30
Truyen Thai Y (feat. Masew),Ngô Kiến Huy,191530,['v-pop'],Truyen Thai Y (feat. Masew),2019-08-27,1,181014,False,37
Tất Cả Đứng Im (feat. HIEUTHUHAI),Ngô Kiến Huy,191530,['v-pop'],Tất Cả Đứng Im (feat. HIEUTHUHAI),2022-11-14,1,176250,False,37
Sao Em Biết Người Rời Đi Không Buồn,Ngô Kiến Huy,191530,['v-pop'],Sao Em Biết Người Rời Đi Không Buồn,2022-12-15,1,301463,False,35
Nàng Xuân,Ngô Kiến Huy,191530,['v-pop'],Gala Nhạc Việt 9: Chúc Tết Mọi Nhà,2017-01-04,14,217917,False,33
Chẳng Thể Giữ Lấy Chẳng Đành Buông Tay,Ngô Kiến Huy,191530,['v-pop'],Chẳng Thể Giữ Lấy Chẳng Đành Buông Tay,2020-09-27,2,293538,False,30
Giả Vờ Yêu...,Ngô Kiến Huy,191530,['v-pop'],Giả Vờ Yêu...,2018-09-25,3,276280,False,28
Nghi Ngờ,Ngô Kiến Huy,191530,['v-pop'],Tuyển Tập Của Ngô Kiến Huy,2018-09-25,103,231066,False,26
Lu Mờ Tâm Trí,Ngô Kiến Huy,191530,['v-pop'],Lu Mờ Tâm Trí,2022-10-27,1,267444,False,24
72 Phép Thần Thông (feat. Yuno Bigboi),Ngô Kiến Huy,191530,['v-pop'],72 Phép Thần Thông (feat. Yuno Bigboi),2021-01-15,1,226389,False,22
Thank You - Những Chiến Binh Thầm Lặng,Ngô Kiến Huy,191530,['v-pop'],Thank You - Những Chiến Binh Thầm Lặng,2020-04-13,2,200100,False,22
vaicaunoicokhiennguoithaydoi,tlinh,243841,"['indie viet', 'v-pop', 'vietnamese hip hop', 'vietnamese melodic rap']",vaicaunoicokhiennguoithaydoi,2022-06-20,1,225862,False,65
Thích Quá Rùi Nà,tlinh,243841,"['indie viet', 'v-pop', 'vietnamese hip hop', 'vietnamese melodic rap']",Thích Quá Rùi Nà,2020-03-24,1,178285,False,59
có hẹn với thanh xuân,tlinh,243841,"['indie viet', 'v-pop', 'vietnamese hip hop', 'vietnamese melodic rap']",Hương Mùa Hè,2022-07-24,17,222000,False,58
Gái Độc Thân,tlinh,243841,"['indie viet', 'v-pop', 'vietnamese hip hop', 'vietnamese melodic rap']",Gái Độc Thân,2021-06-30,1,185175,False,54
